username,password,name,sex,email,mobile,dob,address,jobno
amits2,cW!XvCPg8DOMq,Amit Shukla,M,amits2.@gmail.com,8868759358,1990-06-12,"50, Old Town, Varanasi, Uttar Pradesh - 221006",50
shr26,FVWlURKe5@,Shreya Saxena,F,shr26@yahoo.com,6840957248,1999-03-02,"68, Park Street, Lucknow, Uttar Pradesh - 226025",17
rituk9,DQh12d?Rp,Ritu Khanna,F,rituk988@gmail.com,8732107797,2003-07-19,"223, New Colony, Pune, Maharashtra - 411026",39
deep99,7z3*hkT!,Deepak Dutta,M,deep999@yahoo.com,7691569976,1985-12-19,"172, New Colony, Noida, Uttar Pradesh - 201338",29
kun05,RoHape!*7Uq1,Kunal Saxena,M,kun05.@hotmail.com,9480660781,1975-03-11,"138, Sector 14, Thiruvananthapuram, Kerala - 695011",30
rav65,HCy!7C@3,Ravi Tripathi,M,rav6555@mail.com,9129557055,1972-02-15,"246, Market Road, Kolkata, West Bengal - 700001",39
kartik9,soX!#HqCKQ9O,Kartik Bhat,M,kartik910@yahoo.com,8130224539,1958-09-14,"210, Market Road, Jodhpur, Rajasthan - 342026",9
aish2,s*6RW3!Hk,Aisha Mehta,F,aish2.@yahoo.com,9540089585,1971-04-15,"33, MG Road, Vishakhapatnam, Andhra Pradesh - 530038",3
suni17,8w*#Y7bN3t27@3,Sunita Lal,F,suni17@yahoo.com,6632073568,1987-09-17,"30, Rajiv Gandhi Road, Delhi, Delhi - 110091",17
karans7,tWrA8N@N!a,Karan Shetty,M,karans7.@rediffmail.com,8636516371,1984-12-31,"141, Indira Nagar, Noida, Uttar Pradesh - 201302",28
gaurit24,RX1JnpZb#xqfU4,Gauri Tripathi,F,gaurit24@outlook.com,7195028486,1986-06-20,"157, Indira Nagar, Coimbatore, Tamil Nadu - 641075",36
amrita2,RU8$sftis,Amrita Shukla,F,amrita2@gmail.com,9454249568,1992-02-16,"2, Main Road, Mysore, Karnataka - 570023",27
rupes4,GQlMB*b6ivK,Rupesh Saxena,M,rupes4@outlook.com,8382948470,1989-05-25,"167, Station Road, Chandigarh, Chandigarh - 160076",49
kun11,P03Zs%h$4lhWD,Kunal Joshi,M,kun1188@gmail.com,6343538819,1999-03-31,"40, Phase 1, Bhavnagar, Gujarat - 364015",42
trisha4,iSNZUtxqI?F5#,Trisha Suri,F,trisha4@gmail.com,7747664702,1979-10-30,"170, S V Road, Cuttack, Odisha - 753035",23
aparn7,nZ!v3iJVX$,Aparna Ahmad,F,aparn7@mail.com,7295618485,2000-02-11,"113, Main Road, Mysore, Karnataka - 570010",31
ravikh5,e2?uB0p2?PMKi,Ravi Khanna,M,ravikh534@gmail.com,7251464022,1998-09-25,"176, Civil Lines, Chennai, Tamil Nadu - 600097",41
isha12,tCb?Zi2Nv,Ishaan Iyer,M,isha12@outlook.com,8602685078,1961-08-11,"121, Market Road, Indore, Madhya Pradesh - 452069",12
uma33,Ft$5Vfv%4wDL$,Uma Nanda,F,uma33.@gmail.com,7212840677,1985-11-17,"4, Market Road, Dehradun, Uttarakhand - 248042",8
aish9,*MQ5q$@w4A,Aisha Rangan,F,aish9.@rediffmail.com,9844373989,1979-06-05,"99, Civil Lines, Varanasi, Uttar Pradesh - 221084",21
bhavna9,Ugb!!86jw%ige7,Bhavna Suri,F,bhavna9@rediffmail.com,6262209771,1972-12-04,"77, Rajiv Gandhi Road, Aligarh, Uttar Pradesh - 202003",4
radhik2,vAI2@SQOVmq,Radhika Dutta,F,radhik2.@hotmail.com,8642813425,1984-07-18,"76, MG Road, Aligarh, Uttar Pradesh - 202096",18
din78,03pnr%0Yz3,Dinesh Lal,M,din78.@hotmail.com,9115959828,2001-03-25,"192, Indira Nagar, Nagpur, Maharashtra - 440031",5
pavans37,1zs$rAIZ,Pavan Saxena,M,pavans37@mail.com,6647610091,1979-01-24,"35, Phase 1, Ranchi, Jharkhand - 834046",48
ritu6,67gP*yzLV$t#cE,Ritu Shukla,F,ritu6@rediffmail.com,7072283190,1970-12-25,"139, Ring Road, Jaipur, Rajasthan - 302071",2
roha31,Ee6Eyh%x,Rohan Ghosh,M,roha3159@gmail.com,6984174831,1969-04-28,"160, New Colony, Vadodara, Gujarat - 390057",25
gaurib7,7Du8U9*C,Gauri Bhattacharya,F,gaurib7.@hotmail.com,7640047310,1987-07-29,"32, Phase 1, Jodhpur, Rajasthan - 342036",49
sheet31,M@yh7eD6GtMp,Sheetal Kumar,F,sheet31@yahoo.com,9079053413,1987-02-07,"153, Station Road, Varanasi, Uttar Pradesh - 221081",49
karti6,6hUoJOKx#To,Kartik Gupta,M,karti6@hotmail.com,8307137588,1964-06-19,"221, Old Town, Noida, Uttar Pradesh - 201300",5
parulp62,$A?hF2yEkEV,Parul Prasad,F,parulp6210@mail.com,6517396112,1973-07-26,"40, Shastri Nagar, Rajkot, Gujarat - 360070",50
gauriu95,52yTcF@ROfkEG,Gauri Upadhyay,F,gauriu9542@outlook.com,7948890607,1997-06-03,"134, S V Road, Ludhiana, Punjab - 141013",19
charu57,6TKP!f%c5rkMA,Charu Yadav,F,charu5783@outlook.com,8039371912,1967-01-28,"198, Market Road, Amritsar, Punjab - 143088",3
kaly31,y%W2Q9dXZXqz!?,Kalyani Nambiar,F,kaly31@hotmail.com,6685188272,1971-03-22,"24, Rajiv Gandhi Road, Vishakhapatnam, Andhra Pradesh - 530024",23
yashku33,S#5h#2L0,Yash Kumar,M,yashku3358@gmail.com,6021964721,1979-05-24,"164, Shastri Nagar, Gurgaon, Haryana - 122060",32
hima14,$hmU$L92JyKL,Himanshu Bhattacharya,M,hima1431@mail.com,6773058174,2000-12-06,"47, Shastri Nagar, Solapur, Maharashtra - 413017",30
viv83,Qy71$8nmrZ,Vivek Joshi,M,viv83.@yahoo.com,9637204491,1984-05-10,"27, Station Road, Raipur, Chhattisgarh - 492032",29
amrita4,#cdSC2lt6LUZJ,Amrita Roy,F,amrita4@mail.com,9937553621,1974-09-10,"133, Phase 1, Patiala, Punjab - 147091",50
bhav29,?G?X%32fdl?,Bhavna Tripathi,F,bhav29@yahoo.com,7705385603,2000-12-10,"106, Shastri Nagar, Ludhiana, Punjab - 141045",9
vandan6,EI*05iyO87,Vandana Reddy,F,vandan6.@yahoo.com,8135519167,1988-04-16,"11, Indira Nagar, Varanasi, Uttar Pradesh - 221080",42
vandan64,k$jRqFVxCCG34,Vandana Kulkarni,F,vandan64@hotmail.com,9202362813,1986-01-21,"196, Park Street, Thiruvananthapuram, Kerala - 695045",32
jay59,t6Pt0U!lS,Jaya Singh,F,jay59.@gmail.com,7323458661,1966-09-04,"96, Shastri Nagar, Noida, Uttar Pradesh - 201395",24
saurab00,zuJl7K%Fw?ZQP,Saurabh Shetty,M,saurab0054@hotmail.com,6526952045,1992-02-10,"211, New Colony, Lucknow, Uttar Pradesh - 226025",45
saurab4,Wo1j%g68eY@,Saurabh Singh,M,saurab487@mail.com,8612529222,2001-11-14,"123, Main Road, Raipur, Chhattisgarh - 492059",47
seemai8,rWEx#tXZn!LHe4,Seema Iyer,F,seemai8.@mail.com,9170594984,1975-11-23,"83, Ring Road, Nagpur, Maharashtra - 440069",6
bha48,@@z8%#7M,Bhavesh Shukla,M,bha4859@rediffmail.com,9815283767,1959-04-07,"87, Shastri Nagar, Dibrugarh, Assam - 786026",13
ganesh5,GMa*1@v#,Ganesh Menon,M,ganesh534@hotmail.com,7013458731,1984-06-20,"158, Civil Lines, Shillong, Meghalaya - 793021",10
aparn7,E3f0f8r?YrW,Aparna Shetty,F,aparn715@yahoo.com,9058454048,1959-12-15,"66, Indira Nagar, Noida, Uttar Pradesh - 201302",5
ish99,YPbmj$4S,Ishaan Ghosh,M,ish9988@rediffmail.com,7631557200,1984-10-07,"173, Old Town, Mangalore, Karnataka - 575055",15
prat1,eq0QOdTE9#U?Y,Prateek Ghosh,M,prat130@rediffmail.com,8578289542,1973-09-17,"174, Phase 1, Solapur, Maharashtra - 413050",23
lataag1,qFCpjy$8dF7,Lata Agarwal,F,lataag1.@gmail.com,7036008562,1976-09-27,"78, Rajiv Gandhi Road, Bhubaneswar, Odisha - 751009",48
omkaru6,G33mwGyv8%tSG,Omkar Upadhyay,M,omkaru6.@rediffmail.com,9212525937,2001-11-02,"165, Old Town, Bilaspur, Chhattisgarh - 495041",23
manish9,fb4j5Reda!U8,Manish Chandra,M,manish9@rediffmail.com,9052908689,1967-08-08,"135, Park Street, Pune, Maharashtra - 411026",17
ishaga3,3*ps0VOT7g6,Isha Garg,F,ishaga356@hotmail.com,6892965296,1983-02-26,"145, New Colony, Ranchi, Jharkhand - 834009",21
adit89,35wj%9FA0s,Aditya Basu,M,adit8978@rediffmail.com,9936742531,1992-02-06,"198, S V Road, Hyderabad, Telangana - 500022",5
suresh71,!sav1mKlyEj,Suresh Chatterjee,M,suresh71@hotmail.com,9309995131,1985-01-06,"127, Park Street, Vadodara, Gujarat - 390004",27
har22,P6EatDB@jF9A7,Harini Garg,F,har2295@mail.com,9973273919,1974-02-21,"197, Market Road, Udaipur, Rajasthan - 313007",46
rajes08,@BR?7XfvqN2THI,Rajesh Suri,M,rajes0873@mail.com,9937102756,1977-10-30,"96, Phase 1, Coimbatore, Tamil Nadu - 641046",45
sameer2,vxo2F#DH,Sameer Singh,M,sameer26@gmail.com,6866192115,1999-06-15,"205, Phase 1, Chandigarh, Chandigarh - 160061",43
bhav5,A323LzWtwN@,Bhavya Singh,F,bhav5.@rediffmail.com,6386872601,1968-07-29,"79, Station Road, Patna, Bihar - 800016",33
char31,w2Rl$t%7n6HQm,Charu Shetty,F,char31@yahoo.com,8022757455,1982-01-13,"211, Main Road, Ranchi, Jharkhand - 834057",49
monaku7,4?YE1h?4y3Fq?,Mona Kulkarni,F,monaku7.@rediffmail.com,7372289609,1994-12-05,"71, Indira Nagar, Kolkata, West Bengal - 700067",9
deepa7,zBR22%1pMVZfR,Deepak Sengupta,M,deepa7.@yahoo.com,9283554360,1966-12-07,"201, Indira Nagar, Solapur, Maharashtra - 413041",11
gauris9,#rTjzs?U2,Gauri Sharma,F,gauris9@gmail.com,7412606894,1969-11-10,"19, Civil Lines, Mysore, Karnataka - 570037",7
mohit3,EYXKkC!aSRV27e,Mohit Dutta,M,mohit332@rediffmail.com,8768635572,1962-11-24,"127, Phase 1, Patna, Bihar - 800014",39
arvin1,51%ne0Sce$2sVb,Arvind Sharma,M,arvin1@rediffmail.com,7913576634,1979-05-30,"63, Station Road, Kolkata, West Bengal - 700091",40
asho0,X$al2WK$2,Ashok Tiwari,M,asho0@hotmail.com,6450811786,1968-05-07,"190, Market Road, Chandigarh, Chandigarh - 160008",1
vikra9,@6XsBfwrC,Vikram Sinha,M,vikra9@outlook.com,8730432772,1991-01-15,"249, Sector 14, Agra, Uttar Pradesh - 282097",47
deepak2,TaKh0wUY6#,Deepak Sharma,M,deepak2.@mail.com,8475563506,1969-09-23,"75, Ring Road, Patna, Bihar - 800089",26
priti0,yklEGK9C!,Priti Tripathi,F,priti0.@mail.com,6281793028,1973-08-07,"244, Phase 1, Delhi, Delhi - 110085",36
kar10,#fS?B@OfH?Ve3n,Karan Chauhan,M,kar10@outlook.com,9121280622,1994-12-18,"123, MG Road, Dehradun, Uttarakhand - 248003",27
indr95,HL$IMz5!,Indrajit Suri,M,indr95.@gmail.com,9579916289,1963-01-07,"148, Indira Nagar, Chandigarh, Chandigarh - 160093",12
kunal69,mMW%w5M?,Kunal Basu,M,kunal69@rediffmail.com,7043683188,1963-05-06,"38, S V Road, Delhi, Delhi - 110071",8
sakshi13,F6vWxSM?H,Sakshi Dutta,F,sakshi13@mail.com,6993990699,1977-10-26,"145, Station Road, Solapur, Maharashtra - 413091",48
kunal6,a5y$VWov,Kunal Ghosh,M,kunal6.@outlook.com,9338757247,1960-12-30,"6, Main Road, Nagpur, Maharashtra - 440021",22
ani99,Ttk79c$lg*,Anirudh Banerjee,M,ani99@gmail.com,6354000864,1966-09-14,"53, Park Street, Delhi, Delhi - 110069",31
ashokg4,EI8s$mz9Gcpse,Ashok Garg,M,ashokg450@outlook.com,9522380555,1971-03-25,"244, Shastri Nagar, Ahmedabad, Gujarat - 380049",11
sau06,geU#w93YM,Saurabh Nair,M,sau06.@yahoo.com,7559117788,1994-11-12,"99, New Colony, Surat, Gujarat - 395046",3
sure66,k@bM!93Z,Suresh Khanna,M,sure6639@outlook.com,8246128778,1963-01-16,"203, Park Street, Amritsar, Punjab - 143007",26
rud18,$ndVBqh@yGBH0z,Rudra Mishra,M,rud18@rediffmail.com,7866240770,1969-11-14,"45, S V Road, Kolhapur, Maharashtra - 416082",39
bhavn8,L@h6U44SBoTzGJ,Bhavna Sengupta,F,bhavn8@rediffmail.com,7888666769,1981-04-10,"104, Phase 1, Gurgaon, Haryana - 122075",37
rame57,LlMG4uZM?q!TY,Ramesh Chandra,M,rame5734@hotmail.com,9848590858,1992-03-29,"77, Phase 1, Ludhiana, Punjab - 141008",9
ramesh3,N1Fw?e$Fvo1yk,Ramesh Jain,M,ramesh3@mail.com,8987500728,1985-12-31,"27, Phase 1, Jaipur, Rajasthan - 302053",5
ashokv55,yenp$@BYV$5,Ashok Verma,M,ashokv5599@rediffmail.com,6501801412,1971-09-27,"178, New Colony, Kochi, Kerala - 682063",43
jatin61,lq9tI5*Dy2C!Q1,Jatin Mishra,M,jatin61@rediffmail.com,6712292401,1961-07-16,"93, Shastri Nagar, Nagpur, Maharashtra - 440064",8
pav61,*g4%Ot4sBm,Pavan Patel,M,pav61@outlook.com,9861330689,1969-09-21,"236, Sector 14, Mysore, Karnataka - 570014",3
haris7,KWM*yrxQ9UTg*,Harish Rangan,M,haris7.@hotmail.com,7325538045,1965-11-24,"115, Main Road, Patiala, Punjab - 147014",42
karank5,R9%zCM9T,Karan Khanna,M,karank572@rediffmail.com,9734060367,1991-07-18,"28, MG Road, Aligarh, Uttar Pradesh - 202084",46
divy1,X5Fg?11hOTMC7@,Divya Pillai,F,divy1@gmail.com,9663846623,1988-10-04,"116, Shastri Nagar, Nagpur, Maharashtra - 440014",45
kriti75,Ugu*SG*x9,Kriti Ahmad,F,kriti7587@rediffmail.com,8840130027,1983-09-18,"65, Park Street, Udaipur, Rajasthan - 313086",19
pav81,Cd8A?JxpWV2SVA,Pavan Khan,M,pav8197@rediffmail.com,7792161153,1996-06-11,"143, Ring Road, Vadodara, Gujarat - 390015",17
rame1,TH2vyTNb9?,Ramesh Chauhan,M,rame1.@yahoo.com,7632964576,1968-04-17,"89, Sector 14, Jodhpur, Rajasthan - 342026",40
vikra9,t!4i8M*z,Vikram Lal,M,vikra9@rediffmail.com,6626268288,1997-01-17,"210, Station Road, Kolhapur, Maharashtra - 416071",30
neh12,b$4RDSAh,Neha Gupta,F,neh12@hotmail.com,6266293801,1977-09-22,"192, Phase 1, Jaipur, Rajasthan - 302078",19
ashok5,!BELfNdoZ0oY,Ashok Lal,M,ashok586@gmail.com,9606215936,1979-01-16,"73, S V Road, Pune, Maharashtra - 411001",32
neela55,EZka5p@Zq6,Neelam Nambiar,F,neela5523@rediffmail.com,6881528000,2003-07-03,"8, Indira Nagar, Solapur, Maharashtra - 413054",38
vikra85,YYup1e$IG5BJT,Vikram Ahmad,M,vikra85@yahoo.com,9222657398,1961-07-31,"83, Station Road, Kolhapur, Maharashtra - 416075",18
ritu6,prx4*u%1SC,Ritu Khan,F,ritu6@yahoo.com,7371287442,1972-06-19,"214, Phase 1, Kolhapur, Maharashtra - 416000",37
man11,9YQm8$R4%,Manish Menon,M,man11@rediffmail.com,7651695031,1959-06-27,"134, Indira Nagar, Thiruvananthapuram, Kerala - 695096",10
pra51,59eV9czS%1K,Pranav Sinha,M,pra51.@yahoo.com,6284177510,1976-06-06,"206, Main Road, Aligarh, Uttar Pradesh - 202041",28
smitak32,HmM?M1MBM$yN3,Smita Khan,F,smitak32.@mail.com,6884602367,1993-12-11,"168, Market Road, Jamshedpur, Jharkhand - 831029",4
himans2,pq4lqZk@caPJc,Himanshu Nanda,M,himans293@rediffmail.com,8382944015,1964-06-29,"76, Main Road, Amritsar, Punjab - 143098",17
kritit42,poAY277rH%,Kriti Tripathi,F,kritit42.@gmail.com,9680943829,1975-01-23,"189, Civil Lines, Patiala, Punjab - 147022",17
nikh37,%Cv6%7a7,Nikhil Joshi,M,nikh3798@hotmail.com,9250745536,1973-09-06,"250, Station Road, Mangalore, Karnataka - 575064",45
roha5,tLLQzI4qG@,Rohan Lal,M,roha574@yahoo.com,6785818740,1995-10-26,"35, Rajiv Gandhi Road, Patiala, Punjab - 147085",47
jayak80,@Wf4FR0G,Jaya Kapoor,F,jayak80@hotmail.com,7565923574,1965-01-13,"158, Ring Road, Thane, Maharashtra - 400649",11
charum0,u5SH7k*sEs,Charu Menon,F,charum0.@mail.com,6230940759,1967-04-29,"159, Park Street, Surat, Gujarat - 395009",25
laksh6,Q70wf!GT*,Lakshmi Bhat,F,laksh681@mail.com,9563358432,1985-03-27,"1, Market Road, Mumbai, Maharashtra - 400088",23
har99,puCazJB?Ma6,Harini Khan,F,har9937@mail.com,8481266261,1959-09-28,"13, Market Road, Lucknow, Uttar Pradesh - 226009",19
kavyas00,$?v3gF5P,Kavya Sengupta,F,kavyas0010@outlook.com,7188817274,1961-01-03,"118, Old Town, Thiruvananthapuram, Kerala - 695075",14
madhu1,%Hq*DdyuxUi8B,Madhuri Lal,F,madhu189@yahoo.com,8724639703,1971-10-23,"138, Shastri Nagar, Aligarh, Uttar Pradesh - 202014",21
esha6,!uXenH4WmE,Esha Chandra,F,esha6.@hotmail.com,8475786363,1963-09-07,"248, Market Road, Jodhpur, Rajasthan - 342081",44
kaly24,8Hn8e*5iDd,Kalyani Ahmad,F,kaly2429@mail.com,6096984637,1995-04-26,"204, Old Town, Shillong, Meghalaya - 793006",34
navee9,$A3%ZdDTNnMM,Naveen Reddy,M,navee9@rediffmail.com,9995984683,1979-08-06,"140, Civil Lines, Varanasi, Uttar Pradesh - 221035",48
ananya0,tj*9J0a%,Ananya Tripathi,F,ananya0@outlook.com,8128223552,1964-12-04,"84, Shastri Nagar, Bilaspur, Chhattisgarh - 495044",45
faizr7,18?c0i#x6DZM,Faiz Rangan,M,faizr7@mail.com,9975047134,1962-06-04,"103, Ring Road, Dehradun, Uttarakhand - 248005",50
pavann13,Nrs9GDKVh*Cq,Pavan Nair,M,pavann13.@rediffmail.com,7492617072,1971-04-02,"4, Main Road, Nagpur, Maharashtra - 440061",29
pooj52,V8izU?!rK$QY,Pooja Rao,F,pooj5285@hotmail.com,6086239038,1965-11-24,"51, Market Road, Indore, Madhya Pradesh - 452095",46
vikra4,qR89a*4R5*yIF,Vikram Bhat,M,vikra467@rediffmail.com,7454364165,1976-02-25,"80, Old Town, Jaipur, Rajasthan - 302075",9
kaly0,kZ*%Xcvd#25u,Kalyani Chatterjee,F,kaly0@yahoo.com,6364567384,1970-05-04,"50, Civil Lines, Bhopal, Madhya Pradesh - 462007",1
char0,p5rB?cFTYvA,Charu Saxena,F,char067@outlook.com,6556023384,1995-11-26,"157, Rajiv Gandhi Road, Nagpur, Maharashtra - 440005",10
van51,COmn$FWXr2Fr,Vandana Tripathi,F,van5194@rediffmail.com,7337956181,1962-08-09,"79, Ring Road, Gurgaon, Haryana - 122079",19
rahu6,7o?o3IATPI,Rahul Nair,M,rahu680@rediffmail.com,7016086829,1962-05-26,"107, Park Street, Pune, Maharashtra - 411012",43
prate0,u6?KjlVLDe,Prateek Shukla,M,prate062@mail.com,8482569647,2002-08-27,"207, Park Street, Patiala, Punjab - 147082",19
roh61,t9$2RCaMnIzGvx,Rohan Iyer,M,roh61.@mail.com,9976468537,1995-02-20,"15, Indira Nagar, Dibrugarh, Assam - 786055",44
nup53,Pm1l2K#cz6Lixv,Nupur Khan,F,nup53.@yahoo.com,6302057913,2001-05-17,"224, Market Road, Bilaspur, Chhattisgarh - 495033",50
arvi7,P!dV8w#GMag,Arvind Lal,M,arvi736@hotmail.com,9621195155,1982-04-26,"242, Old Town, Lucknow, Uttar Pradesh - 226085",11
ashok41,1$PVObmWdD5,Ashok Nambiar,M,ashok4112@outlook.com,6467422869,1993-03-05,"180, Rajiv Gandhi Road, Indore, Madhya Pradesh - 452067",21
jay14,eJNujFFBX5hOM%,Jaya Singh,F,jay1470@yahoo.com,7609545458,1973-10-21,"245, Phase 1, Cuttack, Odisha - 753001",39
pri21,0uA?NvYkKkVn,Priti Nanda,F,pri21.@rediffmail.com,6059120456,1992-05-05,"98, Phase 1, Noida, Uttar Pradesh - 201356",31
saurab8,JjTa@S9v2,Saurabh Ahmad,M,saurab8@outlook.com,9543165825,1994-11-10,"148, Main Road, Ranchi, Jharkhand - 834000",31
aishab07,qy4Q$VUKYJTR,Aisha Basu,F,aishab0774@hotmail.com,9392165372,2000-06-13,"44, S V Road, Agra, Uttar Pradesh - 282009",48
viv58,sZI#e!Y9rP,Vivek Nanda,M,viv58@yahoo.com,7874367158,1962-11-16,"68, Shastri Nagar, Kolhapur, Maharashtra - 416080",30
harini99,$v63MtsKD,Harini Kapoor,F,harini9956@mail.com,8320637775,1975-06-28,"87, New Colony, Ludhiana, Punjab - 141061",36
kar45,*#O5tgnb3TSl$,Kartik Sharma,M,kar45.@outlook.com,6692497310,1963-08-07,"100, Main Road, Thane, Maharashtra - 400692",17
rajesh6,@Eh1DQUpL,Rajesh Reddy,M,rajesh6@mail.com,6962795594,1997-02-13,"217, Old Town, Noida, Uttar Pradesh - 201377",35
rohans5,S?4xK6v$dz,Rohan Shah,M,rohans539@outlook.com,6630671175,2001-11-22,"17, Shastri Nagar, Thane, Maharashtra - 400653",35
pooja3,3c@8FUmk@BNU1,Pooja Patel,F,pooja3@outlook.com,7808156023,1994-01-25,"31, New Colony, Raipur, Chhattisgarh - 492051",14
eshan1,nOlzj*Y2q,Eshan Desai,M,eshan112@mail.com,8487626549,1961-05-17,"47, Old Town, Rajkot, Gujarat - 360049",41
rad21,?0ttpDLT521n,Radhika Jain,F,rad21.@hotmail.com,9079174187,1987-03-31,"51, Old Town, Gurgaon, Haryana - 122063",50
moh78,k#AFHc7jH9%,Mohit Saxena,M,moh78.@outlook.com,9138676619,1978-08-10,"106, Indira Nagar, Hyderabad, Telangana - 500058",14
gau48,k9nN9O@aK,Gauri Malhotra,F,gau4862@gmail.com,9407642329,1959-06-06,"172, Ring Road, Mysore, Karnataka - 570014",37
prat47,oRK0UAV?uZ,Prateek Chauhan,M,prat4766@hotmail.com,6136315072,1988-01-18,"139, Station Road, Patna, Bihar - 800067",49
pava3,zvFQ6I#dG5,Pavan Shukla,M,pava3@outlook.com,7291264856,1984-04-20,"249, New Colony, Gurgaon, Haryana - 122051",23
esh10,TLKNqH2FTH$95N,Esha Shukla,F,esh1022@yahoo.com,8117971195,1997-07-22,"95, Park Street, Surat, Gujarat - 395027",43
radhi5,Bwj!1kFIR,Radhika Chatterjee,F,radhi573@outlook.com,8679153484,1966-04-19,"15, S V Road, Raipur, Chhattisgarh - 492065",15
mee86,Qv!3$m$P,Meera Singh,F,mee86.@hotmail.com,8345287441,1996-01-10,"230, Phase 1, Bilaspur, Chhattisgarh - 495015",6
aditya90,0!m@j1mYMXCC,Aditya Kapoor,M,aditya90@gmail.com,7298468446,1979-12-16,"31, Shastri Nagar, Delhi, Delhi - 110029",5
ritusi6,VOdkr%FYW5b,Ritu Sinha,F,ritusi668@gmail.com,7710758863,1990-07-11,"137, S V Road, Pune, Maharashtra - 411031",9
ananya3,Q2npD9%g5,Ananya Yadav,F,ananya3.@hotmail.com,8149591371,1969-07-19,"37, Old Town, Aligarh, Uttar Pradesh - 202021",9
ish04,e2iB1Jer!Ug,Ishaan Roy,M,ish04.@rediffmail.com,8387650875,1975-03-09,"44, Rajiv Gandhi Road, Nagpur, Maharashtra - 440070",47
aditya6,C1DJ5O@v*,Aditya Bhattacharya,M,aditya6.@rediffmail.com,6043476824,1996-05-24,"220, Station Road, Thiruvananthapuram, Kerala - 695088",44
snehas14,Vnz19VlBZn@c*,Sneha Sharma,F,snehas14.@mail.com,9951414290,1962-09-28,"128, New Colony, Chennai, Tamil Nadu - 600001",39
rit65,H$7Tx3#LosZ,Ritika Kapoor,F,rit65@rediffmail.com,8814337545,2000-02-25,"144, Indira Nagar, Mysore, Karnataka - 570010",17
ritus3,0zb2OS?3,Ritu Shah,F,ritus3@mail.com,7265903303,1999-05-09,"222, Phase 1, Jodhpur, Rajasthan - 342059",18
lak33,VluoDI7%Uz3!,Lakshay Sinha,M,lak3329@mail.com,6755255430,1985-01-29,"206, Ring Road, Amritsar, Punjab - 143045",13
bhavya71,wUT?mI84,Bhavya Pillai,F,bhavya71@hotmail.com,9116343802,1995-01-01,"211, Ring Road, Vadodara, Gujarat - 390062",39
gau12,L!s%c7?Do2SntJ,Gautam Bhat,M,gau1251@yahoo.com,7179589928,1979-05-12,"32, Shastri Nagar, Rajkot, Gujarat - 360083",38
apar2,KFd7$C4g,Aparna Shukla,F,apar2@hotmail.com,9780968696,1979-07-03,"142, Phase 1, Surat, Gujarat - 395039",24
bhaves0,uj1l?Ev0I74,Bhavesh Bhat,M,bhaves043@outlook.com,6865368740,1962-09-04,"165, Park Street, Kolhapur, Maharashtra - 416067",9
gauta5,hF5%*860,Gautam Joshi,M,gauta5@mail.com,8714189829,1978-07-09,"250, Sector 14, Hyderabad, Telangana - 500017",11
gautam20,@sFFUE1Xi!,Gautam Nambiar,M,gautam2027@yahoo.com,8711709242,1999-02-08,"3, Sector 14, Hyderabad, Telangana - 500013",45
zoyaku45,!qr!w0?D,Zoya Kulkarni,F,zoyaku45.@yahoo.com,6525981351,1968-06-25,"12, Park Street, Raipur, Chhattisgarh - 492049",18
diksh89,$H@YEnRMn2#K,Diksha Verma,F,diksh89.@hotmail.com,9417132287,1982-06-22,"229, New Colony, Varanasi, Uttar Pradesh - 221055",1
yash6,$jh1A#bzFw,Yash Reddy,M,yash642@mail.com,7206300933,1973-12-21,"248, Shastri Nagar, Patna, Bihar - 800080",14
anirud6,EyYg4$Pdz3n@!,Anirudh Yadav,M,anirud6@rediffmail.com,8966795604,1965-02-07,"77, Park Street, Mysore, Karnataka - 570096",20
arvin00,Xd$4QC8G,Arvind Prasad,M,arvin00@outlook.com,6082546629,1974-10-17,"48, Station Road, Kochi, Kerala - 682076",44
ish30,?4%YZuVPQ6oTU,Ishaan Khan,M,ish3062@yahoo.com,7467134401,1971-09-04,"180, Sector 14, Dibrugarh, Assam - 786094",29
saurab3,Pw6MY$U6,Saurabh Verma,M,saurab330@gmail.com,6430844493,1997-02-19,"42, Ring Road, Delhi, Delhi - 110074",29
ajays87,3QE$UY662j5,Ajay Saxena,M,ajays87.@yahoo.com,7593261858,1988-04-19,"30, S V Road, Vishakhapatnam, Andhra Pradesh - 530025",32
neela7,8@%WhEUIFeh6,Neelam Garg,F,neela721@hotmail.com,9748138129,1958-08-04,"214, Shastri Nagar, Patna, Bihar - 800042",11
suresh6,2@8Dy$Ej9,Suresh Dutta,M,suresh6.@hotmail.com,9910766906,1984-07-13,"103, Rajiv Gandhi Road, Gurgaon, Haryana - 122065",20
radhi61,1E43Sx%QOuR,Radhika Sharma,F,radhi6166@hotmail.com,8710752779,1967-11-28,"16, Indira Nagar, Bilaspur, Chhattisgarh - 495036",23
sid27,q#6hXUK%T9u,Siddharth Upadhyay,M,sid27@mail.com,9800844355,1993-06-02,"150, Sector 14, Surat, Gujarat - 395069",45
shee5,F*cKJ2WMVko,Sheetal Jain,F,shee5.@hotmail.com,8347150882,2001-11-07,"32, Market Road, Mumbai, Maharashtra - 400038",27
parulk7,RUjX2?tk0gY,Parul Kapoor,F,parulk7.@mail.com,6875775151,1962-09-29,"134, Civil Lines, Varanasi, Uttar Pradesh - 221075",2
jati2,fO9Hww$KH,Jatin Khan,M,jati2.@gmail.com,6952171960,1987-03-09,"7, Old Town, Indore, Madhya Pradesh - 452003",21
yasha9,qIP?JB3g,Yash Agarwal,M,yasha9.@gmail.com,9690551761,1994-06-29,"22, Indira Nagar, Coimbatore, Tamil Nadu - 641062",10
mona99,0a#P*bOG?5tH,Mona Banerjee,F,mona9951@gmail.com,7798258896,1998-08-13,"63, New Colony, Vadodara, Gujarat - 390093",30
pooj96,$B2MAWHv,Pooja Roy,F,pooj96@hotmail.com,9831760494,1977-11-15,"6, Shastri Nagar, Dibrugarh, Assam - 786029",23
arjun29,*7BonWi4B8,Arjun Nambiar,M,arjun29@yahoo.com,8988728096,1980-09-09,"144, Rajiv Gandhi Road, Udaipur, Rajasthan - 313049",42
mohitp1,t5C08nap%OEp,Mohit Prasad,M,mohitp19@mail.com,6040798249,1962-11-19,"134, Shastri Nagar, Bhubaneswar, Odisha - 751020",39
gitame19,?1ki@uME,Gita Mehta,F,gitame19@rediffmail.com,9256037863,1960-05-01,"133, Main Road, Mangalore, Karnataka - 575051",1
esha15,NJdOi$p9mj,Eshan Garg,M,esha152@rediffmail.com,7058841297,1988-08-22,"171, Sector 14, Thiruvananthapuram, Kerala - 695069",39
ritus23,ppOa0pz$,Ritu Syed,F,ritus23@hotmail.com,6001215700,1975-10-01,"45, Civil Lines, Nagpur, Maharashtra - 440087",22
pra89,2Vhve#6*,Pranav Joshi,M,pra89@yahoo.com,7133592061,1984-05-23,"84, Civil Lines, Lucknow, Uttar Pradesh - 226007",9
sun76,mwGQ#I8Vz,Sunita Chandra,F,sun76.@yahoo.com,9243182072,1989-07-17,"150, MG Road, Chandigarh, Chandigarh - 160046",28
gaurip8,0@f!sIIEmu,Gauri Prasad,F,gaurip8@hotmail.com,7627781618,1981-06-05,"198, Ring Road, Mumbai, Maharashtra - 400023",26
rit69,0Z*h3MJG2,Ritu Upadhyay,F,rit69.@outlook.com,6351908834,1994-03-10,"138, Ring Road, Aligarh, Uttar Pradesh - 202030",3
deepak2,UGw@v%rlSC6,Deepak Rao,M,deepak2.@mail.com,6430393914,1964-03-03,"245, Rajiv Gandhi Road, Thane, Maharashtra - 400681",14
diksha6,gS8ajBVte*,Diksha Sengupta,F,diksha6@hotmail.com,9387388416,1996-10-06,"99, Rajiv Gandhi Road, Mangalore, Karnataka - 575066",7
krit2,z00*RijY1C!!I,Kriti Patel,F,krit282@mail.com,9378301937,2001-06-28,"18, Station Road, Mangalore, Karnataka - 575052",29
navi8,k4ffKoA0!UyD,Navin Malhotra,M,navi8@rediffmail.com,6032291000,1975-03-29,"172, Station Road, Udaipur, Rajasthan - 313028",43
nav58,iuo%oyL#R3,Naveen Banerjee,M,nav58@mail.com,8630235915,1973-05-20,"246, Station Road, Surat, Gujarat - 395059",45
zoya1,OqAPq7SWQ?O!xk,Zoya Yadav,F,zoya1@mail.com,6279481370,1995-03-23,"209, Ring Road, Kolhapur, Maharashtra - 416072",47
neel09,%3J8mZevR,Neelam Bhat,F,neel0923@rediffmail.com,7207372122,1998-03-20,"52, Ring Road, Solapur, Maharashtra - 413084",24
madhur4,Xn!HL?uD0$2f,Madhuri Banerjee,F,madhur4.@yahoo.com,9190873443,1991-06-24,"126, Ring Road, Thane, Maharashtra - 400665",27
rahu7,WRAyz5YdD%,Rahul Shah,M,rahu7@hotmail.com,7698076935,1965-03-17,"233, Civil Lines, Ludhiana, Punjab - 141081",28
kritik34,9CWol?43aZsHd,Kriti Kapoor,F,kritik34@yahoo.com,9194810172,1994-09-04,"161, Rajiv Gandhi Road, Coimbatore, Tamil Nadu - 641068",11
vivekg2,0a$3sTH$sA,Vivek Gupta,M,vivekg2.@rediffmail.com,9363323369,1987-08-18,"1, Sector 14, Pune, Maharashtra - 411084",9
faizi72,?7vyb4C%%mT,Faiz Iyer,M,faizi7261@mail.com,6721155851,1965-10-24,"214, New Colony, Cuttack, Odisha - 753099",30
rajesh52,v!lY#1X!E,Rajesh Iyer,M,rajesh5269@mail.com,9068976637,1992-03-28,"165, Shastri Nagar, Kolhapur, Maharashtra - 416058",15
haris1,YAs3Nvi*X#,Harish Iyer,M,haris167@rediffmail.com,7108382261,1983-06-05,"192, New Colony, Lucknow, Uttar Pradesh - 226088",3
tan97,W*og5Yzw7U#,Tania Bhattacharya,F,tan97.@mail.com,9973526183,1969-09-29,"193, Shastri Nagar, Raipur, Chhattisgarh - 492058",46
gaur16,?UYZEgYNa3,Gauri Rangan,F,gaur16@gmail.com,8596402469,1991-09-05,"204, New Colony, Aligarh, Uttar Pradesh - 202067",42
ishame0,Ub*dCJ7N,Isha Menon,F,ishame083@outlook.com,8500971805,2001-10-31,"133, Indira Nagar, Chennai, Tamil Nadu - 600057",42
