username,password,name,sex,email,mobile,dob,address,jobno
kavyar3,ZAg$uDH7mo,Kavya Reddy,F,kavyar3@yahoo.com,7645007987,1990-11-16,"235, Park Street, Vadodara, Gujarat - 390015",44
ana45,a82e?INS,Ananya Nanda,F,ana45.@gmail.com,9182895968,1983-02-13,"15, Station Road, Mumbai, Maharashtra - 400046",34
ankit40,28e?$1ZaSmC,Ankit Roy,M,ankit40@outlook.com,6703984810,1999-06-26,"208, Phase 1, Chennai, Tamil Nadu - 600056",1
smi53,4K@7OjCNNwGj3,Smita Roy,F,smi5340@gmail.com,7970203562,1974-06-08,"120, Rajiv Gandhi Road, Chennai, Tamil Nadu - 600029",47
esha8,NZ7qE0*$E,Esha Pillai,F,esha8.@yahoo.com,9976841034,1997-11-11,"181, MG Road, Vadodara, Gujarat - 390034",22
shreya2,!90ahIwXL,Shreya Dutta,F,shreya2.@rediffmail.com,9090329607,1973-02-02,"7, Phase 1, Solapur, Maharashtra - 413073",15
ish10,22!!$eyV,Isha Roy,F,ish10.@yahoo.com,7937654834,1961-12-07,"26, Shastri Nagar, Patiala, Punjab - 147041",9
sar75,B3aa%Qe*UZ,Sarita Ahmad,F,sar75@yahoo.com,9069202602,1988-03-20,"158, Rajiv Gandhi Road, Jamshedpur, Jharkhand - 831015",23
shank0,@%D0S$NNbCB,Shankar Lal,M,shank062@hotmail.com,7796525932,1958-04-02,"126, Sector 14, Noida, Uttar Pradesh - 201338",11
prit6,cTRtAAiv*r@7OF,Priti Sharma,F,prit6@mail.com,9802695420,1968-06-19,"99, Phase 1, Hyderabad, Telangana - 500047",40
vivek3,wl1YvzNR8mB$,Vivek Lal,M,vivek3.@outlook.com,9861918827,1958-07-20,"49, Phase 1, Indore, Madhya Pradesh - 452071",42
rav54,!lIVoD91,Ravi Ghosh,M,rav5473@outlook.com,9163577794,1977-05-17,"141, Phase 1, Chennai, Tamil Nadu - 600061",38
sneha9,a%BoGvX1mj,Sneha Suri,F,sneha9.@hotmail.com,9967987099,1975-08-11,"3, New Colony, Aligarh, Uttar Pradesh - 202016",1
vikr2,8jq6X?WXIei3c,Vikram Menon,M,vikr2@hotmail.com,7944356276,1972-07-11,"23, Phase 1, Rajkot, Gujarat - 360068",48
navink09,cB%$XrLQ!qt3,Navin Kapoor,M,navink09.@outlook.com,9478379053,1990-06-13,"78, S V Road, Kolkata, West Bengal - 700027",17
vandan3,aVSnpj?9C,Vandana Patel,F,vandan3@gmail.com,8927697953,1971-07-29,"174, Market Road, Pune, Maharashtra - 411086",3
sar64,3p?N9xXMHT4AX,Sarita Lal,F,sar645@yahoo.com,6088543734,1993-01-09,"145, New Colony, Aligarh, Uttar Pradesh - 202023",30
ritus79,AA1KM3sYg5E@?,Ritu Sengupta,F,ritus79.@rediffmail.com,8581317333,1998-01-27,"29, Indira Nagar, Indore, Madhya Pradesh - 452090",18
kun11,C4oL9Jnb13*2ik,Kunal Dutta,M,kun11@gmail.com,6350921392,1973-10-23,"228, Rajiv Gandhi Road, Vishakhapatnam, Andhra Pradesh - 530054",18
anjali6,U028Kv*p4,Anjali Iyer,F,anjali6@yahoo.com,9020896314,1963-08-23,"238, Rajiv Gandhi Road, Delhi, Delhi - 110036",43
vikr8,16neXFD#m,Vikram Singh,M,vikr8@gmail.com,7133753906,2001-06-24,"89, Park Street, Patna, Bihar - 800079",23
kuna6,yV95tpOP6h1m@9,Kunal Chatterjee,M,kuna66@yahoo.com,9671518304,1971-12-29,"26, Main Road, Noida, Uttar Pradesh - 201369",36
chir08,*run0BKZEs6k*,Chirag Lal,M,chir0845@mail.com,7766819438,1988-04-13,"96, New Colony, Kochi, Kerala - 682003",41
nis03,$7T1iTHqPw1va?,Nisha Reddy,F,nis03@hotmail.com,8703579634,1982-01-05,"20, S V Road, Chennai, Tamil Nadu - 600076",22
ish75,7333e%kIS,Isha Singh,F,ish75@mail.com,6102279645,1998-09-21,"10, S V Road, Noida, Uttar Pradesh - 201394",5
ishaan0,f%Y2SK%G$UbV,Ishaan Nanda,M,ishaan0@mail.com,9319676110,1968-11-10,"18, Main Road, Agra, Uttar Pradesh - 282087",32
ishave4,0FE2BLIGu$va%,Isha Verma,F,ishave4.@yahoo.com,8321532414,1965-02-04,"226, New Colony, Ahmedabad, Gujarat - 380053",37
laks6,OFxK0@qfUzDh,Lakshmi Agarwal,F,laks6.@hotmail.com,8892277731,1979-12-11,"63, Indira Nagar, Rajkot, Gujarat - 360078",18
seema2,@d8GYwCvk?P#,Seema Saxena,F,seema2@mail.com,7140385167,1991-03-30,"121, Shastri Nagar, Bhubaneswar, Odisha - 751058",9
kun24,MQY4yjN*c2,Kunal Sharma,M,kun24.@rediffmail.com,8689548969,1981-06-04,"93, Market Road, Bhavnagar, Gujarat - 364022",21
mad25,cBC#@4grZn,Madhuri Saxena,F,mad25.@yahoo.com,9747667505,1986-02-25,"182, Rajiv Gandhi Road, Bhavnagar, Gujarat - 364018",25
dee64,p@6e2?o4Cu,Deepak Suri,M,dee64@outlook.com,8777119621,1970-01-23,"103, S V Road, Bhubaneswar, Odisha - 751092",1
amit4,!1*zC4xE21D,Amit Saxena,M,amit4@gmail.com,7975242279,1969-10-29,"33, Market Road, Bengaluru, Karnataka - 560020",38
arju6,C5bE!J85T,Arjun Chauhan,M,arju6@rediffmail.com,7903559166,1988-06-16,"224, Rajiv Gandhi Road, Amritsar, Punjab - 143001",39
eshan3,#mkr%YrJN24w,Eshan Garg,M,eshan389@outlook.com,6688408206,1978-03-27,"39, Main Road, Rajkot, Gujarat - 360019",40
krit38,r@bDMkZmm!71$p,Kriti Ghosh,F,krit38.@hotmail.com,8490555532,1959-11-13,"3, Indira Nagar, Bhopal, Madhya Pradesh - 462036",50
saksh7,PBPi$Rvo9!*,Sakshi Nambiar,F,saksh7@gmail.com,9035160371,1983-08-24,"19, Main Road, Ahmedabad, Gujarat - 380099",50
suni37,u$S3l0QSqUmm4,Sunita Patel,F,suni3727@gmail.com,7670258718,1965-07-05,"218, Park Street, Indore, Madhya Pradesh - 452008",5
apa31,8$u0Mnwh?aR,Aparna Verma,F,apa3173@outlook.com,9648579628,1985-11-19,"31, S V Road, Dibrugarh, Assam - 786041",19
rahu98,2KtCQ!evg,Rahul Nambiar,M,rahu98.@yahoo.com,9556556517,1959-10-15,"57, Rajiv Gandhi Road, Kolkata, West Bengal - 700044",48
mad31,w%8RaRkB3,Madan Sharma,M,mad3154@yahoo.com,6036144228,1976-07-21,"157, Rajiv Gandhi Road, Amritsar, Punjab - 143037",14
nav31,1RfvDBhzIak@6,Navin Jain,M,nav3160@rediffmail.com,6539774840,1961-11-24,"194, New Colony, Vishakhapatnam, Andhra Pradesh - 530078",11
him82,TCFI%E7e,Himanshu Khan,M,him8245@outlook.com,7707773685,1973-04-29,"223, Main Road, Jamshedpur, Jharkhand - 831050",21
suni3,RNv09*IREYP6,Sunita Kapoor,F,suni3@rediffmail.com,9362365405,2003-03-23,"29, Phase 1, Cuttack, Odisha - 753042",30
sun25,Sl!23j5I,Sunita Khanna,F,sun25.@gmail.com,9459052831,1977-11-13,"143, Rajiv Gandhi Road, Mumbai, Maharashtra - 400055",43
rames85,hx5x7%*#qkTZ,Ramesh Sinha,M,rames8514@rediffmail.com,8609325714,1984-05-24,"115, S V Road, Vishakhapatnam, Andhra Pradesh - 530007",47
indraj4,$ubd!0oRVzZrs,Indrajit Iyer,M,indraj4@outlook.com,7713358197,1974-07-13,"32, S V Road, Indore, Madhya Pradesh - 452002",41
esh44,4p24rE6Jz*l,Esha Garg,F,esh44@yahoo.com,6021108972,1970-11-05,"249, Sector 14, Solapur, Maharashtra - 413044",18
ganes65,vXsFV4@xC,Ganesh Ghosh,M,ganes65.@gmail.com,6352422327,1984-09-11,"224, Market Road, Coimbatore, Tamil Nadu - 641078",19
prate38,4Opc6PKJ#ngc,Prateek Iyer,M,prate38.@rediffmail.com,7853151251,1963-08-14,"47, Station Road, Raipur, Chhattisgarh - 492043",21
mohi8,QhuAYHI%MbED71,Mohit Chandra,M,mohi8.@gmail.com,6615545529,1988-07-15,"25, Old Town, Bhopal, Madhya Pradesh - 462005",43
seema2,q8%UYOZ4ME!X,Seema Banerjee,F,seema2.@mail.com,9768888256,1998-07-16,"119, MG Road, Hyderabad, Telangana - 500097",34
smi72,hY8$xp*Kfcm,Smita Rao,F,smi72.@rediffmail.com,6807688588,1997-12-13,"148, MG Road, Mangalore, Karnataka - 575031",28
ritu0,810ZnZGUVZb%Uk,Ritu Kulkarni,F,ritu0.@hotmail.com,6245635151,1983-06-05,"16, Rajiv Gandhi Road, Raipur, Chhattisgarh - 492012",30
gauta75,fJVM@y6P@,Gautam Reddy,M,gauta75.@rediffmail.com,8998439426,1992-08-13,"62, S V Road, Thane, Maharashtra - 400641",23
karan3,HFLA07Db2J?qT,Karan Shah,M,karan3@gmail.com,9938386280,1991-06-29,"10, Civil Lines, Ahmedabad, Gujarat - 380065",9
sunit4,Fh8KNeUR?,Sunita Sharma,F,sunit4.@outlook.com,8686699515,1982-12-17,"131, Sector 14, Jamshedpur, Jharkhand - 831078",49
aish5,$MnDM1iEsSp,Aisha Sengupta,F,aish527@outlook.com,9635722402,1978-11-12,"3, S V Road, Bhavnagar, Gujarat - 364009",23
ajayme1,@%e65M2e#,Ajay Menon,M,ajayme1.@hotmail.com,6074570229,1979-07-20,"165, Station Road, Dehradun, Uttarakhand - 248004",40
divy7,N*GmZOo79Y*a,Divya Menon,F,divy7@rediffmail.com,6035030054,1973-03-28,"240, Rajiv Gandhi Road, Kolkata, West Bengal - 700010",39
kaly8,CLxvy1G%ceX,Kalyani Garg,F,kaly828@outlook.com,6176102857,2000-05-26,"168, Phase 1, Chennai, Tamil Nadu - 600041",2
priti41,aqDd%sGr3%2,Priti Sengupta,F,priti41.@gmail.com,7325717975,1985-05-16,"211, Sector 14, Dibrugarh, Assam - 786074",12
tris16,@dKXb4GfG3,Trisha Singh,F,tris16@gmail.com,6519590854,1983-08-14,"156, Shastri Nagar, Bilaspur, Chhattisgarh - 495054",31
kiranl2,b%E*Fs8ZBaT,Kiran Lal,F,kiranl2@gmail.com,9575889396,1975-09-16,"59, Ring Road, Raipur, Chhattisgarh - 492055",18
neha2,l#$meakHZXN4,Neha Bhattacharya,F,neha271@outlook.com,7779456057,1966-01-27,"65, Station Road, Ahmedabad, Gujarat - 380040",38
anir1,G9ZL*AYoQK1,Anirudh Syed,M,anir1@gmail.com,6989562108,1997-12-25,"238, Station Road, Hyderabad, Telangana - 500050",6
kriti15,o03Jee@TCtREz0,Kriti Pillai,F,kriti15@hotmail.com,6875059655,1983-12-05,"39, Rajiv Gandhi Road, Mumbai, Maharashtra - 400030",23
rupes4,$?v3u1Lpl$u$gb,Rupesh Pillai,M,rupes437@outlook.com,6806224012,1970-11-10,"23, MG Road, Mangalore, Karnataka - 575008",12
manish3,uEY4Aa%wX,Manish Syed,M,manish3.@outlook.com,7828063047,1976-05-22,"80, Sector 14, Bilaspur, Chhattisgarh - 495082",23
shreya19,D6$A?WJW?xFy2B,Shreya Nanda,F,shreya19.@gmail.com,7563091554,1985-01-13,"33, Civil Lines, Lucknow, Uttar Pradesh - 226032",14
anjali75,6?EcRPZ5,Anjali Kapoor,F,anjali7585@hotmail.com,8601667501,1980-05-06,"220, New Colony, Mumbai, Maharashtra - 400043",22
kira05,6m7bn?Z4!?B8,Kiran Bhattacharya,F,kira05.@gmail.com,8694821765,1962-09-29,"52, Park Street, Kolkata, West Bengal - 700006",7
nup02,j7G?ihVZ,Nupur Basu,F,nup02.@yahoo.com,8667050686,1987-06-27,"236, MG Road, Shillong, Meghalaya - 793060",29
laks14,q7ZG1dRP%,Lakshmi Rao,F,laks14.@yahoo.com,7868592411,1988-05-26,"11, Sector 14, Chandigarh, Chandigarh - 160085",7
prana07,IUuS$L7jz35b,Pranav Suri,M,prana07.@outlook.com,9086346289,1990-09-19,"192, Rajiv Gandhi Road, Aligarh, Uttar Pradesh - 202090",4
yash0,#AK431dtrg#,Yash Kapoor,M,yash0@gmail.com,8976883213,1964-05-24,"122, Old Town, Thane, Maharashtra - 400638",36
kritiv72,IT#83Lr4gkwt?H,Kriti Verma,F,kritiv7218@gmail.com,9930235532,1991-10-08,"12, Shastri Nagar, Solapur, Maharashtra - 413065",11
nav22,4FAlXcGI$heei1,Naveen Shah,M,nav22.@yahoo.com,6782038763,1972-07-14,"45, Main Road, Varanasi, Uttar Pradesh - 221027",44
riti53,9jEVnO#6,Ritika Tripathi,F,riti53.@mail.com,7318454086,1981-08-14,"236, Rajiv Gandhi Road, Ludhiana, Punjab - 141053",44
prana7,Z*KlNA01G5,Pranav Kumar,M,prana7.@gmail.com,9584324070,1981-04-18,"217, Park Street, Lucknow, Uttar Pradesh - 226048",48
prat0,2Su0$Fh55,Prateek Chandra,M,prat0.@yahoo.com,8125523989,1958-09-15,"150, Indira Nagar, Kochi, Kerala - 682081",12
par98,4e5m7FL$V,Parul Garg,F,par9844@gmail.com,6211819321,1997-07-11,"145, Ring Road, Bhopal, Madhya Pradesh - 462074",16
bha39,YBPLYf4h5%,Bhavesh Saxena,M,bha3921@gmail.com,9262780874,1987-09-16,"117, Indira Nagar, Bhopal, Madhya Pradesh - 462016",23
eshan75,E47xO%0C,Eshan Nanda,M,eshan7586@gmail.com,7517979820,1981-03-29,"147, Rajiv Gandhi Road, Ranchi, Jharkhand - 834002",11
meer0,6!S1wzklH,Meera Bhat,F,meer092@gmail.com,7858827672,1972-07-21,"218, Civil Lines, Nagpur, Maharashtra - 440031",28
roh57,sxO%?sldH2PvE,Rohan Suri,M,roh57.@hotmail.com,8200172024,1966-10-10,"34, Park Street, Agra, Uttar Pradesh - 282030",15
navi49,JrEW@phU5!9I@D,Navin Dutta,M,navi49@gmail.com,8683327151,1979-05-02,"216, MG Road, Jodhpur, Rajasthan - 342054",38
umana6,I4?4Lqjw%,Uma Nair,F,umana6@outlook.com,9681221553,1990-02-11,"242, MG Road, Jamshedpur, Jharkhand - 831014",35
dik35,%BLZlxWYGX81ln,Diksha Malhotra,F,dik3522@yahoo.com,7137537947,1984-11-26,"45, Market Road, Coimbatore, Tamil Nadu - 641045",17
ind72,amjlCa%9CW,Indrajit Sharma,M,ind72.@outlook.com,7142076075,1980-01-14,"196, Civil Lines, Shillong, Meghalaya - 793051",11
gau28,BnB5@ZBH%jd0c,Gauri Gupta,F,gau28@hotmail.com,9086862814,1959-02-12,"240, Shastri Nagar, Kolhapur, Maharashtra - 416062",6
tani03,KGd@9G$cJ73oCm,Tania Nair,F,tani0366@outlook.com,6984612182,1977-08-31,"79, Ring Road, Coimbatore, Tamil Nadu - 641070",32
nikhi7,qN?pj6z%6lrG18,Nikhil Malhotra,M,nikhi71@hotmail.com,7538491323,1959-06-09,"149, Shastri Nagar, Bengaluru, Karnataka - 560025",17
anjali67,8YHZof%sdo,Anjali Kapoor,F,anjali67@hotmail.com,8803560049,1972-12-23,"216, Station Road, Varanasi, Uttar Pradesh - 221005",22
laksha2,cW6xELn!@,Lakshay Chauhan,M,laksha2@gmail.com,9479517484,1983-03-25,"158, MG Road, Hyderabad, Telangana - 500074",42
neela58,%yCV3I7vP4W,Neelam Kulkarni,F,neela58@yahoo.com,6606577547,1960-09-01,"101, Civil Lines, Gurgaon, Haryana - 122010",5
git18,N8lkQFUiyLW?,Gita Banerjee,F,git18.@rediffmail.com,8126592862,1987-04-28,"176, New Colony, Cuttack, Odisha - 753060",19
kalyan0,Kz1nTfL%?%x,Kalyani Syed,F,kalyan060@rediffmail.com,6459336663,1962-08-25,"98, New Colony, Pune, Maharashtra - 411088",38
ind09,B*Rcd!#EcC7udS,Indrajit Bhattacharya,M,ind0939@hotmail.com,6601553564,1982-09-23,"20, Phase 1, Hyderabad, Telangana - 500054",38
naveen1,MqiKmd0M!62,Naveen Shetty,M,naveen181@yahoo.com,8358401726,1970-10-17,"42, New Colony, Cuttack, Odisha - 753082",39
esha4,rN#B8fAW4,Eshan Gupta,M,esha418@hotmail.com,6327276877,1982-12-23,"5, Civil Lines, Udaipur, Rajasthan - 313088",18
rahulg2,nD$wIk6iA3,Rahul Ghosh,M,rahulg2.@mail.com,7102631460,1995-05-29,"19, Sector 14, Noida, Uttar Pradesh - 201395",27
saurab99,e$PLV*B9Y7oZ,Saurabh Ghosh,M,saurab9933@yahoo.com,6582623679,1965-08-05,"33, Phase 1, Lucknow, Uttar Pradesh - 226000",5
taniak1,p1uev#xSct?X,Tania Kumar,F,taniak176@rediffmail.com,9683179193,1971-07-30,"133, Park Street, Kolkata, West Bengal - 700028",2
dik95,98Kz*1?M?@ce,Diksha Prasad,F,dik95.@outlook.com,7767928373,1981-02-10,"182, Park Street, Ahmedabad, Gujarat - 380039",43
navin0,?7fpSPy@,Navin Tiwari,M,navin0.@rediffmail.com,6551417883,1998-03-30,"141, S V Road, Nagpur, Maharashtra - 440002",28
rajesh7,CP7w2*$a1R,Rajesh Shukla,M,rajesh7.@hotmail.com,9126075350,1966-07-25,"230, Indira Nagar, Raipur, Chhattisgarh - 492042",40
yami69,!p5dq7aU,Yamini Dutta,F,yami69@rediffmail.com,7180237770,1991-05-09,"142, Phase 1, Ranchi, Jharkhand - 834062",45
jat31,jc6nW#oXqKdVo,Jatin Tripathi,M,jat316@yahoo.com,6975657682,1977-12-13,"24, Civil Lines, Hyderabad, Telangana - 500069",25
divya23,6OKBfi@m,Divya Mehta,F,divya2329@outlook.com,6493246786,1970-05-06,"230, Civil Lines, Solapur, Maharashtra - 413007",19
aparn22,@zjz$ArWC6PjN*,Aparna Reddy,F,aparn22.@gmail.com,8902328315,1965-11-14,"163, Phase 1, Kolhapur, Maharashtra - 416020",35
roh11,WNn@bzkXs00$hz,Rohan Kulkarni,M,roh11.@outlook.com,8622690256,1983-08-07,"58, Market Road, Bhubaneswar, Odisha - 751005",41
madana6,42wil?jQzk*G,Madan Ahmad,M,madana6.@gmail.com,9046794139,1990-11-01,"94, MG Road, Amritsar, Punjab - 143009",44
ravi79,EziP1efDxr#,Ravi Tripathi,M,ravi7934@mail.com,8263995345,1965-03-04,"239, Market Road, Kolhapur, Maharashtra - 416065",28
bhav3,hMI#3RXR,Bhavna Khanna,F,bhav332@mail.com,9880288110,1990-04-15,"126, Civil Lines, Vishakhapatnam, Andhra Pradesh - 530028",10
suni5,Ml7jjM%!Bqzm43,Sunita Garg,F,suni5@gmail.com,7215290627,1983-01-09,"36, Civil Lines, Nagpur, Maharashtra - 440094",5
faizsh8,NM4@Qk9w*xdepC,Faiz Sharma,M,faizsh8.@outlook.com,9420859942,2000-11-23,"237, Shastri Nagar, Delhi, Delhi - 110042",24
kun61,2IWY*jtYGcjZ,Kunal Shah,M,kun6148@gmail.com,9800715967,1994-03-16,"243, Phase 1, Surat, Gujarat - 395072",29
pritis51,9?S*LNtHw,Priti Shetty,F,pritis51@hotmail.com,7148217923,1969-09-24,"41, Old Town, Pune, Maharashtra - 411057",35
jatin29,I*EWVfa@0,Jatin Mehta,M,jatin2923@yahoo.com,8345487591,1998-05-24,"165, Market Road, Ludhiana, Punjab - 141060",43
sak69,*xP%4BWGS,Sakshi Shah,F,sak69.@rediffmail.com,9162069131,1963-04-29,"226, Park Street, Varanasi, Uttar Pradesh - 221043",9
karan9,wyvB$w0O9TK$8,Karan Jain,M,karan9@hotmail.com,6343318827,2000-05-16,"2, Park Street, Nagpur, Maharashtra - 440088",13
mon78,kb8n1b#$ueqoSP,Mona Prasad,F,mon7886@gmail.com,9684488548,1988-03-14,"143, Ring Road, Lucknow, Uttar Pradesh - 226013",40
latas9,JlS*uN6GVI?,Lata Sharma,F,latas9@mail.com,8268020967,1987-10-19,"72, S V Road, Ludhiana, Punjab - 141080",13
riti5,F#$JvVo7hKQ,Ritika Patel,F,riti583@outlook.com,8142718067,1991-10-20,"160, Shastri Nagar, Bhavnagar, Gujarat - 364024",31
lat10,F%@f*3@34gs,Lata Kulkarni,F,lat1054@rediffmail.com,6992416169,1960-06-02,"227, Park Street, Lucknow, Uttar Pradesh - 226026",37
vikram8,8wEZrS9wGE*Rdt,Vikram Sengupta,M,vikram860@gmail.com,8536535673,1994-05-02,"54, Market Road, Dehradun, Uttarakhand - 248025",27
arvi6,hC3%hBR6bUe,Arvind Singh,M,arvi6@gmail.com,9047858052,1971-03-02,"143, Park Street, Agra, Uttar Pradesh - 282036",15
suresh39,DJHCw5w!,Suresh Sengupta,M,suresh39@mail.com,6786813667,1997-06-22,"232, MG Road, Udaipur, Rajasthan - 313036",34
tris28,Lfe$B9h%5j,Trisha Shetty,F,tris28.@mail.com,9876754865,1970-10-02,"164, Ring Road, Chandigarh, Chandigarh - 160086",23
kiran9,peZj?$D?7440,Kiran Verma,F,kiran9.@hotmail.com,9719662597,1976-09-11,"10, Park Street, Bhavnagar, Gujarat - 364050",36
bhavn18,1ejFYx6$Y,Bhavna Tiwari,F,bhavn18.@outlook.com,9737363206,1982-01-08,"239, Rajiv Gandhi Road, Dibrugarh, Assam - 786091",5
pri80,m5A9t?5%pe0UD,Priya Rao,F,pri8076@yahoo.com,9262298483,1960-08-26,"186, New Colony, Varanasi, Uttar Pradesh - 221057",12
chirag4,C$$T?6xa,Chirag Joshi,M,chirag418@mail.com,7250824424,1990-02-15,"190, MG Road, Jamshedpur, Jharkhand - 831008",40
mohit8,eIjq0%7l,Mohit Chatterjee,M,mohit8@gmail.com,9273057768,1988-01-16,"150, Shastri Nagar, Guwahati, Assam - 781011",44
mad60,r%Z#1Z@!o5exX*,Madhuri Pillai,F,mad60.@hotmail.com,8370628102,1999-02-02,"133, Sector 14, Ludhiana, Punjab - 141053",5
laksh5,*gEn7I3WoH,Lakshay Sharma,M,laksh5@gmail.com,8244690704,1962-01-25,"172, Phase 1, Jamshedpur, Jharkhand - 831063",20
ramesh4,DW2N@zaXsnU?,Ramesh Upadhyay,M,ramesh443@mail.com,8903817070,1994-09-06,"10, Station Road, Mysore, Karnataka - 570032",48
amitme8,@jc?Xqjq2,Amit Mehta,M,amitme8@gmail.com,6812525163,1991-12-27,"204, Civil Lines, Ahmedabad, Gujarat - 380017",17
charu1,2u1lFq6#OE,Charu Lal,F,charu1.@mail.com,9682656142,1994-04-25,"86, Old Town, Hyderabad, Telangana - 500013",26
nee48,ShL3?@zeC,Neelam Syed,F,nee48.@outlook.com,9763566478,1988-06-03,"64, Park Street, Dibrugarh, Assam - 786028",46
jaya1,LC7f?Zp#$Ss,Jaya Basu,F,jaya1@outlook.com,7246677700,1978-02-24,"243, Market Road, Udaipur, Rajasthan - 313003",33
lak24,el6PG!a5g,Lakshay Chauhan,M,lak2450@hotmail.com,7199317741,1982-12-09,"192, S V Road, Lucknow, Uttar Pradesh - 226096",25
radhik9,duOT7ZR3@,Radhika Upadhyay,F,radhik924@outlook.com,9750490652,1977-10-19,"29, MG Road, Rajkot, Gujarat - 360013",11
kal47,s5fpGT9is0!T,Kalyani Syed,F,kal47.@outlook.com,7099049576,1965-06-13,"13, Indira Nagar, Delhi, Delhi - 110038",11
deepak9,$%91jRbr1Pr,Deepak Mishra,M,deepak9@mail.com,9564952503,2001-02-10,"219, Old Town, Pune, Maharashtra - 411087",8
man69,AKggj63%$eJ4aU,Manish Garg,M,man69@rediffmail.com,6270946191,1983-09-07,"64, New Colony, Bhopal, Madhya Pradesh - 462013",4
mad20,xZm4T?$eL2Vn,Madan Bhat,M,mad2067@hotmail.com,9325920356,1988-07-27,"116, Main Road, Vishakhapatnam, Andhra Pradesh - 530099",14
anany8,uz1B$Oy0k,Ananya Yadav,F,anany8.@mail.com,8129369827,2003-12-06,"200, Shastri Nagar, Coimbatore, Tamil Nadu - 641010",41
cha29,lGlIp2%yDjphM2,Charu Khan,F,cha29@hotmail.com,6072613779,1989-02-18,"8, Indira Nagar, Jodhpur, Rajasthan - 342087",13
kaly7,PHeSt*#0S?y#,Kalyani Tripathi,F,kaly7.@mail.com,8203775992,2000-02-15,"105, Shastri Nagar, Dehradun, Uttarakhand - 248047",41
chir6,%RS!A0I!p3UtM,Chirag Patel,M,chir6.@rediffmail.com,6333343560,1982-12-18,"148, Rajiv Gandhi Road, Indore, Madhya Pradesh - 452078",39
par28,wbF0zq$8edzT,Parul Menon,F,par2839@rediffmail.com,6120243668,1984-07-14,"78, Sector 14, Vadodara, Gujarat - 390074",12
priya17,XvgW4Faf%c,Priya Khan,F,priya1737@gmail.com,9148023092,1970-12-15,"204, Main Road, Jamshedpur, Jharkhand - 831062",12
arju30,8Qmtg$E6,Arjun Agarwal,M,arju30@hotmail.com,6457932146,2000-08-07,"102, Civil Lines, Mumbai, Maharashtra - 400098",49
adit10,k@0NCUoYlQSd,Aditya Iyer,M,adit10@outlook.com,7137670735,1958-03-22,"116, S V Road, Bilaspur, Chhattisgarh - 495098",10
rohan82,61*qt1EGRActH,Rohan Verma,M,rohan82.@outlook.com,9336670055,1986-10-24,"141, MG Road, Mysore, Karnataka - 570040",47
deep6,R8jxPD@buG*,Deepak Nair,M,deep683@hotmail.com,9240861092,1988-03-15,"146, Shastri Nagar, Patna, Bihar - 800059",10
lak14,TX%u8VAQiHh?,Lakshay Roy,M,lak14@gmail.com,8603373147,1977-10-07,"17, Shastri Nagar, Shillong, Meghalaya - 793011",18
radh9,m?VGJKCAO5,Radhika Saxena,F,radh9.@mail.com,7395943981,1962-11-13,"197, Park Street, Gurgaon, Haryana - 122078",46
sneh30,VE1#jyjh3Ss,Sneha Shetty,F,sneh30.@outlook.com,9811560026,1970-01-07,"75, Sector 14, Hyderabad, Telangana - 500058",10
saur05,1@CpHEjkI*0B7,Saurabh Tripathi,M,saur05.@yahoo.com,9878292863,2003-09-17,"241, Old Town, Bhopal, Madhya Pradesh - 462054",47
laksha8,*dPVXbti8@99#,Lakshay Kulkarni,M,laksha8@hotmail.com,8347567082,2003-09-19,"164, Shastri Nagar, Varanasi, Uttar Pradesh - 221070",17
sid23,1K*soGkQSwT,Siddharth Verma,M,sid23.@outlook.com,8448509614,1967-03-20,"230, S V Road, Noida, Uttar Pradesh - 201355",46
nav03,NzhE5NNG8X$,Navin Roy,M,nav03@hotmail.com,7260337529,1980-03-14,"168, S V Road, Agra, Uttar Pradesh - 282075",19
anir4,L1ocPLps4%VD5W,Anirudh Khanna,M,anir4.@gmail.com,8871159490,1999-11-28,"241, Rajiv Gandhi Road, Thiruvananthapuram, Kerala - 695009",31
naveen5,F7VZpiwHuF$00,Naveen Sharma,M,naveen5.@yahoo.com,7222607486,2000-02-19,"194, S V Road, Pune, Maharashtra - 411087",28
kartik3,KtQ?Ccn51VqTB,Kartik Basu,M,kartik3.@rediffmail.com,7918572600,1983-07-11,"172, Civil Lines, Mysore, Karnataka - 570047",22
uma93,WoIky0d!Nj5aB,Uma Basu,F,uma9312@yahoo.com,6245839799,1992-10-01,"174, Indira Nagar, Nagpur, Maharashtra - 440021",14
rupe43,Le$V!Is9?Q43ia,Rupesh Roy,M,rupe43.@gmail.com,6532184678,1975-10-11,"82, Rajiv Gandhi Road, Patna, Bihar - 800046",14
sari0,xO%04Bde,Sarita Sengupta,F,sari023@mail.com,7390597607,1962-06-06,"181, Civil Lines, Surat, Gujarat - 395064",6
rudraj5,19617NDq@UAe*,Rudra Jain,M,rudraj587@yahoo.com,6849662159,1985-09-02,"171, Phase 1, Jaipur, Rajasthan - 302064",27
van84,LL!BC%$7TqD9q,Vandana Singh,F,van84.@outlook.com,6564399319,1958-01-23,"75, S V Road, Mangalore, Karnataka - 575058",37
manis44,%mKL7$KMvut,Manish Agarwal,M,manis44@yahoo.com,8830501950,1990-05-24,"2, Old Town, Bengaluru, Karnataka - 560062",39
arvind6,?hijUnY0,Arvind Tripathi,M,arvind6@outlook.com,8170661121,1976-11-30,"163, Market Road, Ahmedabad, Gujarat - 380001",3
rupe9,I$Y$2FbrqSz3Dt,Rupesh Menon,M,rupe9@mail.com,9542623272,1996-07-01,"250, Market Road, Dehradun, Uttarakhand - 248064",33
jatin12,vIlvu*LDDCBH5,Jatin Shukla,M,jatin1299@outlook.com,7663879680,1960-02-19,"203, Ring Road, Bilaspur, Chhattisgarh - 495030",47
faizd4,H@0N0@bAEt@W7,Faiz Desai,M,faizd443@hotmail.com,6366623690,1976-10-25,"59, Rajiv Gandhi Road, Bhubaneswar, Odisha - 751009",39
kaly7,N7Ys!Tk3j3Yg,Kalyani Lal,F,kaly715@gmail.com,8455633064,1961-09-04,"211, Rajiv Gandhi Road, Rajkot, Gujarat - 360065",21
arjun8,6FYc3mv*j0,Arjun Sinha,M,arjun812@hotmail.com,9347814814,1981-02-08,"31, Market Road, Ludhiana, Punjab - 141096",26
roh50,X?6xN@h$Pe0EIX,Rohan Basu,M,roh5030@rediffmail.com,6339660384,1990-11-10,"220, New Colony, Bengaluru, Karnataka - 560011",47
karan4,nw6oOLZfQh6mR$,Karan Bhat,M,karan4@mail.com,6346164199,1963-10-06,"55, Indira Nagar, Coimbatore, Tamil Nadu - 641011",28
kar05,2qeOTNwf!,Kartik Nambiar,M,kar0573@mail.com,9442878080,1982-08-06,"14, MG Road, Raipur, Chhattisgarh - 492081",9
apar46,B!v5j0dlX,Aparna Suri,F,apar46.@hotmail.com,6572450886,1998-01-18,"19, MG Road, Indore, Madhya Pradesh - 452083",16
sur51,hL8cDqy*,Suresh Shah,M,sur5193@outlook.com,7405666797,1959-02-18,"192, Market Road, Mangalore, Karnataka - 575053",32
har01,1da?hwMGqW,Harini Desai,F,har01@rediffmail.com,6673236133,1968-04-22,"48, Sector 14, Rajkot, Gujarat - 360040",29
she75,6BO@jeE5BY@,Sheetal Lal,F,she75.@gmail.com,7726796937,1992-03-16,"127, Phase 1, Indore, Madhya Pradesh - 452022",19
ravisu7,1f9J#BHDKCJhm,Ravi Suri,M,ravisu771@yahoo.com,6054664287,1974-04-02,"244, Park Street, Dibrugarh, Assam - 786077",39
jati9,!detK#fVN3Z,Jatin Rangan,M,jati9@outlook.com,9684657852,2000-10-19,"149, S V Road, Nagpur, Maharashtra - 440046",21
manish1,5y#hzDN%MY$K,Manish Mehta,M,manish1.@outlook.com,7771562950,1976-12-14,"219, Old Town, Ludhiana, Punjab - 141076",38
gaut07,2n*pA?1yhVp$@,Gautam Mishra,M,gaut07.@mail.com,7673753498,1969-02-04,"124, Indira Nagar, Lucknow, Uttar Pradesh - 226027",39
deepa4,5!#Mt8C2R6,Deepak Agarwal,M,deepa416@rediffmail.com,9253027223,1977-07-11,"155, Civil Lines, Kolkata, West Bengal - 700007",31
latat05,75cVNR*jG?QW@,Lata Tiwari,F,latat0528@outlook.com,7944142209,1985-06-02,"167, Park Street, Jaipur, Rajasthan - 302067",18
laks4,!$FLgx3Sv,Lakshay Nambiar,M,laks421@hotmail.com,7870643806,1996-03-14,"17, Main Road, Jodhpur, Rajasthan - 342042",40
divyak1,?@GVjwTRw515,Divya Kapoor,F,divyak1.@yahoo.com,7092335941,1973-01-23,"89, Civil Lines, Varanasi, Uttar Pradesh - 221023",37
shre68,RkaH4szt3@mnDZ,Shreya Reddy,F,shre6856@hotmail.com,6573227199,1987-08-02,"6, Sector 14, Bhubaneswar, Odisha - 751023",2
amrit29,wwDag%3U!8D,Amrita Upadhyay,F,amrit2998@rediffmail.com,8259222766,1996-11-26,"116, S V Road, Vishakhapatnam, Andhra Pradesh - 530055",30
yas78,QsNf06!!,Yash Roy,M,yas78.@hotmail.com,9436074004,1984-03-30,"145, Rajiv Gandhi Road, Surat, Gujarat - 395071",19
shanka50,$*HyNC70Kx,Shankar Nambiar,M,shanka50.@mail.com,7881983962,1987-01-16,"126, Phase 1, Bhavnagar, Gujarat - 364077",20
hima65,bfybd80X?nAEw5,Himanshu Jain,M,hima65.@rediffmail.com,9702319723,1983-03-27,"161, S V Road, Kochi, Kerala - 682025",39
apar1,z3UgXe@V,Aparna Shukla,F,apar1.@outlook.com,9141235659,2001-10-25,"68, Shastri Nagar, Patiala, Punjab - 147047",24
zoya8,Z9E#qeAbK6r4F,Zoya Verma,F,zoya8@hotmail.com,9320776260,1960-11-25,"184, MG Road, Kolhapur, Maharashtra - 416052",3
anany52,Ti%KXxzx@5,Ananya Khanna,F,anany52@rediffmail.com,6078573406,2003-01-10,"152, Old Town, Varanasi, Uttar Pradesh - 221033",6
chira29,ma!@Ivv6JCXE0H,Chirag Mehta,M,chira29.@hotmail.com,8060776017,2002-07-14,"233, Ring Road, Vishakhapatnam, Andhra Pradesh - 530083",31
ganesh9,gIAob!5c,Ganesh Khan,M,ganesh9.@mail.com,8148803219,1972-12-08,"58, Shastri Nagar, Bilaspur, Chhattisgarh - 495056",23
