username,password,name,sex,email,mobile,dob,address,jobno
bhaves3,aPf4y$o!zpU%s@,Bhavesh Shukla,M,bhaves3@outlook.com,8366857699,1991-08-27,"93, Shastri Nagar, Bhubaneswar, Odisha - 751058",8
gaur5,$re09Ds%?Y3K#g,Gauri Ghosh,F,gaur5@gmail.com,6151929241,1965-07-10,"226, New Colony, Bhubaneswar, Odisha - 751031",4
moh03,Oo!?gU8d,Mohit Saxena,M,moh03.@outlook.com,9283815950,1994-06-24,"220, Rajiv Gandhi Road, Jamshedpur, Jharkhand - 831053",4
tan98,*NAb9Qd6,Tania Lal,F,tan9852@yahoo.com,9891083617,1992-03-22,"8, Market Road, Lucknow, Uttar Pradesh - 226012",37
omk51,RFSuUd6$i5dkjn,Omkar Sharma,M,omk51.@hotmail.com,7983988099,1993-11-01,"207, Phase 1, Delhi, Delhi - 110005",12
harish8,N*Io6I*c%rf,Harish Sharma,M,harish8.@mail.com,8415455734,1979-04-28,"53, Phase 1, Chennai, Tamil Nadu - 600060",42
man97,TG86Oo0!bE@QrH,Manish Basu,M,man9776@gmail.com,8450331230,1994-09-05,"56, New Colony, Mysore, Karnataka - 570005",47
manish0,95$I1q4V8wkK,Manish Tiwari,M,manish0@hotmail.com,7085476844,2002-06-06,"5, S V Road, Amritsar, Punjab - 143092",36
navin35,cfEG#RV93W,Navin Malhotra,M,navin3591@hotmail.com,9691478676,1996-01-28,"86, Civil Lines, Surat, Gujarat - 395024",21
rudrag8,YoDN8#34%aoM,Rudra Ghosh,M,rudrag8.@yahoo.com,7577276440,1980-10-16,"168, Old Town, Vishakhapatnam, Andhra Pradesh - 530000",41
sure9,B8?#?c5AzHpZ,Suresh Sharma,M,sure9.@outlook.com,8984740329,1984-10-25,"147, Station Road, Jamshedpur, Jharkhand - 831016",46
char30,3I%xLkqb,Charu Tripathi,F,char30.@yahoo.com,8362705704,1988-10-22,"171, Shastri Nagar, Hyderabad, Telangana - 500086",7
prate0,V1w4DgxvL#tU,Prateek Sinha,M,prate0.@outlook.com,8500372728,1977-12-22,"138, Sector 14, Vishakhapatnam, Andhra Pradesh - 530061",27
dee26,3G#7yxPm,Deepak Chandra,M,dee26.@outlook.com,9876268664,1973-07-08,"242, Main Road, Guwahati, Assam - 781045",26
divya6,Svp!4BqGjUQzw,Divya Saxena,F,divya6.@outlook.com,6185961112,1985-02-02,"1, Ring Road, Coimbatore, Tamil Nadu - 641001",26
uma74,y3I#icXxxPwt,Uma Sengupta,F,uma74.@hotmail.com,6601794720,1996-10-19,"153, Park Street, Aligarh, Uttar Pradesh - 202093",44
gaut7,LUSy23zEO*,Gautam Sengupta,M,gaut7.@yahoo.com,7527923110,1982-05-31,"13, S V Road, Thiruvananthapuram, Kerala - 695048",11
umak4,kV1Ne7E*4bWHJ,Uma Kapoor,F,umak4@rediffmail.com,7939627897,1964-02-17,"227, Market Road, Lucknow, Uttar Pradesh - 226085",28
arju11,2Fc*L@4AkkTO3w,Arjun Suri,M,arju11.@mail.com,8291075893,1977-03-08,"236, Sector 14, Thane, Maharashtra - 400619",44
riti86,X1s3W$J5,Ritika Kumar,F,riti86@gmail.com,8622200112,1992-11-30,"51, MG Road, Mumbai, Maharashtra - 400058",26
gau59,aHq!*PV5jp6GD,Gauri Sinha,F,gau59.@gmail.com,9822818672,1996-07-10,"77, Station Road, Mangalore, Karnataka - 575050",3
bhav63,jX!9Z%pZSz,Bhavna Lal,F,bhav63.@rediffmail.com,7540213256,1993-09-14,"36, Shastri Nagar, Bilaspur, Chhattisgarh - 495089",26
man59,R7taz8w$,Manish Desai,M,man5925@rediffmail.com,6032884325,1988-12-19,"7, Rajiv Gandhi Road, Ahmedabad, Gujarat - 380010",4
deep0,9NHP#*L0xq,Deepak Khan,M,deep053@outlook.com,6831960035,1978-10-20,"162, Market Road, Solapur, Maharashtra - 413052",29
nup48,66eAO$p#v?w,Nupur Pillai,F,nup4834@outlook.com,9374993732,1961-11-16,"78, Old Town, Agra, Uttar Pradesh - 282084",14
bhave0,7f!X1J4O#F,Bhavesh Gupta,M,bhave0.@outlook.com,8836331541,1976-11-06,"130, Main Road, Nagpur, Maharashtra - 440029",2
eshan38,Y7a6Xm$JeN7S#,Eshan Sharma,M,eshan3897@yahoo.com,9124177460,1997-04-11,"92, Station Road, Patna, Bihar - 800015",12
jat59,g2q#Jo2n@,Jatin Garg,M,jat5949@hotmail.com,7606614831,1985-05-30,"35, Market Road, Hyderabad, Telangana - 500034",4
aniru85,R@0RhpaJ%5,Anirudh Pillai,M,aniru85.@hotmail.com,7384895643,1974-03-10,"59, Old Town, Bengaluru, Karnataka - 560051",8
rav67,@T$GR1mK6L,Ravi Sinha,M,rav67.@outlook.com,7519531011,2003-06-12,"121, MG Road, Mumbai, Maharashtra - 400000",3
arvin6,ef9y2*AWZ,Arvind Nanda,M,arvin685@gmail.com,6824837734,1998-02-17,"71, Park Street, Surat, Gujarat - 395082",47
anjal7,DVIGSKg%0o!J%2,Anjali Sinha,F,anjal765@gmail.com,9037549960,1969-08-02,"19, S V Road, Guwahati, Assam - 781011",36
chira2,7xE?aGnSxs!sl,Chirag Chandra,M,chira2@gmail.com,9393899928,1979-05-17,"106, Park Street, Agra, Uttar Pradesh - 282033",6
laks6,WxPSR@n7ulFZ08,Lakshay Reddy,M,laks652@hotmail.com,7886865729,1959-09-07,"76, Park Street, Kolhapur, Maharashtra - 416025",27
him26,VB8%@lW5Gi7,Himanshu Singh,M,him26.@mail.com,6961291483,1963-11-28,"126, Indira Nagar, Surat, Gujarat - 395035",1
himan9,Y2%HKk5g0v0qEL,Himanshu Reddy,M,himan9@mail.com,8474071557,1962-12-27,"77, Indira Nagar, Vishakhapatnam, Andhra Pradesh - 530040",42
taniac48,KPZQ4ki*#XStX,Tania Chatterjee,F,taniac48@hotmail.com,8876876146,1987-12-31,"51, Civil Lines, Mangalore, Karnataka - 575088",7
kunals2,!vv3kpUm6,Kunal Singh,M,kunals2@yahoo.com,7330021007,1990-10-21,"84, Market Road, Guwahati, Assam - 781080",38
uma18,BcqV4eO#j7v43k,Uma Roy,F,uma1894@hotmail.com,8996816834,1968-11-17,"111, Shastri Nagar, Noida, Uttar Pradesh - 201329",41
sure8,Dx6$LU@zD6f,Suresh Jain,M,sure8@hotmail.com,9536540129,1960-02-25,"11, Old Town, Amritsar, Punjab - 143070",3
viveku00,c7ITJO?eg,Vivek Upadhyay,M,viveku0091@mail.com,8083459663,1993-11-28,"138, Shastri Nagar, Dehradun, Uttarakhand - 248014",34
roha48,Rr17UyEt*FUpG,Rohan Sinha,M,roha4814@hotmail.com,8962403204,1995-06-28,"96, Station Road, Coimbatore, Tamil Nadu - 641083",32
arjun4,B@Itr?V5?Z,Arjun Prasad,M,arjun4.@yahoo.com,7774260451,1972-06-07,"28, Main Road, Gurgaon, Haryana - 122024",10
karan09,?TMJJ5k6!@cu?Z,Karan Chatterjee,M,karan09@hotmail.com,7570002139,1959-08-05,"178, Old Town, Patiala, Punjab - 147024",37
pritim1,g1APkkwRP#d3,Priti Malhotra,F,pritim1@yahoo.com,8035029818,1959-01-28,"18, Phase 1, Bhubaneswar, Odisha - 751040",35
pran5,nf*Yij7QOA,Pranav Kulkarni,M,pran534@rediffmail.com,7253724430,1964-08-11,"234, Market Road, Ahmedabad, Gujarat - 380001",44
uma76,b!61AVFsg,Uma Basu,F,uma7649@mail.com,7874572920,1966-05-14,"194, Station Road, Thiruvananthapuram, Kerala - 695051",36
ashok6,$IkF1U8Fv,Ashok Sharma,M,ashok6.@mail.com,9501287331,1971-09-06,"84, New Colony, Mangalore, Karnataka - 575095",4
she29,r$I9h@aiOK*,Sheetal Malhotra,F,she29@yahoo.com,7483975393,1965-11-10,"215, MG Road, Udaipur, Rajasthan - 313009",39
vanda7,Kht!$6AEe,Vandana Rao,F,vanda7.@rediffmail.com,6482800870,1964-06-11,"125, Shastri Nagar, Coimbatore, Tamil Nadu - 641086",21
sari4,!750cD?N,Sarita Joshi,F,sari4@hotmail.com,8842265679,1988-09-21,"241, Park Street, Shillong, Meghalaya - 793029",31
adit2,Vm4Y%RbO,Aditya Chandra,M,adit2.@yahoo.com,6925349247,1975-08-05,"208, Market Road, Dibrugarh, Assam - 786088",25
yami6,o?0W1n#Rs%i,Yamini Bhat,F,yami6@hotmail.com,9617333851,1991-04-14,"101, Ring Road, Surat, Gujarat - 395048",35
priya96,r%XPa*V3Xj,Priya Mehta,F,priya96@outlook.com,6067717084,1995-04-04,"217, S V Road, Chennai, Tamil Nadu - 600045",17
mani0,R900RqK*2*u5V,Manish Gupta,M,mani0@outlook.com,9929899701,1964-06-11,"141, Park Street, Ludhiana, Punjab - 141080",14
arvind1,RcC3PDisun?,Arvind Chandra,M,arvind1@rediffmail.com,6776918188,1998-10-01,"45, Phase 1, Pune, Maharashtra - 411082",38
sarit9,6?t0uFr@rJ,Sarita Nambiar,F,sarit9@outlook.com,8070548336,1963-01-03,"233, Phase 1, Solapur, Maharashtra - 413061",31
tris5,iBY$Gmo4Ena$X,Trisha Kumar,F,tris5.@rediffmail.com,7634570982,1998-07-02,"175, Station Road, Vadodara, Gujarat - 390004",14
gaur51,uzhl7MDYM?,Gauri Sharma,F,gaur5196@mail.com,7512614981,1967-12-05,"228, Sector 14, Bengaluru, Karnataka - 560065",13
ankitm7,jbj#YaEe8k,Ankit Menon,M,ankitm763@mail.com,9723067307,1959-08-24,"227, Station Road, Shillong, Meghalaya - 793001",20
bhav8,Cjq0b?W@c,Bhavna Nair,F,bhav8.@yahoo.com,9321458581,1995-04-13,"102, Civil Lines, Bhavnagar, Gujarat - 364018",28
nupur2,!VObt5#ga2iAAe,Nupur Sinha,F,nupur2@rediffmail.com,7210869457,1966-11-09,"185, Shastri Nagar, Bilaspur, Chhattisgarh - 495013",11
anan16,Z?Bqk*@8SRL$,Ananya Banerjee,F,anan16@hotmail.com,7836847510,1965-05-25,"71, Market Road, Coimbatore, Tamil Nadu - 641059",2
rad74,Q5n?91j%R196Wz,Radhika Suri,F,rad74.@rediffmail.com,6114550334,1970-10-24,"224, Ring Road, Coimbatore, Tamil Nadu - 641038",7
aniru59,y1ZmT%1#,Anirudh Sharma,M,aniru59@hotmail.com,9471555626,2002-06-26,"100, Rajiv Gandhi Road, Vadodara, Gujarat - 390011",16
paru1,mWL?7JHJ0p,Parul Shetty,F,paru1.@yahoo.com,9327800256,1984-08-30,"81, Sector 14, Vadodara, Gujarat - 390066",17
ish49,tqS2X$1n@,Isha Iyer,F,ish4975@rediffmail.com,7959687467,1996-07-03,"130, Indira Nagar, Shillong, Meghalaya - 793035",15
nee43,AU0Gjd6E3GV$85,Neelam Jain,F,nee43@yahoo.com,8221561560,1974-10-21,"23, Shastri Nagar, Chandigarh, Chandigarh - 160091",44
prit2,dPwHs5i?VQjki,Priti Joshi,F,prit2@gmail.com,6440439757,1993-02-18,"197, Park Street, Ahmedabad, Gujarat - 380015",43
himans77,WkL7qb0AN$h!kY,Himanshu Chatterjee,M,himans77@outlook.com,7744458372,1970-04-13,"105, Indira Nagar, Patiala, Punjab - 147095",39
harish0,3$5N$XxW*,Harish Lal,M,harish0.@mail.com,6446494903,1967-09-03,"10, MG Road, Indore, Madhya Pradesh - 452028",17
trisha5,S0D4V*f2m,Trisha Patel,F,trisha5@gmail.com,9014881124,1983-02-05,"117, Shastri Nagar, Indore, Madhya Pradesh - 452002",36
jayash8,5ZbBTk@3m,Jaya Shukla,F,jayash854@outlook.com,8537248460,1996-04-09,"113, Park Street, Surat, Gujarat - 395062",22
shan5,s1%Gs!v3W7pEI,Shankar Chauhan,M,shan5@rediffmail.com,7860631038,1964-09-08,"133, Phase 1, Kolhapur, Maharashtra - 416003",46
mon08,09mM8zeK$NG4%,Mona Bhattacharya,F,mon0811@rediffmail.com,6952049105,1993-12-02,"224, Rajiv Gandhi Road, Patiala, Punjab - 147011",31
van80,n%S8WEHAz,Vandana Mehta,F,van805@gmail.com,6601537003,1983-12-07,"122, Park Street, Varanasi, Uttar Pradesh - 221069",15
vik19,L#$S7t9sTFV,Vikram Gupta,M,vik1986@yahoo.com,6241722978,1966-05-03,"62, Sector 14, Thiruvananthapuram, Kerala - 695099",50
rajesh7,U9vI$gz2@hZw5A,Rajesh Garg,M,rajesh776@gmail.com,6283420323,1997-03-07,"47, Ring Road, Kochi, Kerala - 682032",10
apa90,qW?5eCVK,Aparna Basu,F,apa90@yahoo.com,8845284666,1958-09-30,"227, Park Street, Bengaluru, Karnataka - 560018",17
sameer90,NQjK88?L@6h@l%,Sameer Nambiar,M,sameer90@outlook.com,6452471201,1988-02-21,"13, Shastri Nagar, Ranchi, Jharkhand - 834028",40
ishaan95,eFGuruw%8sOF,Ishaan Tripathi,M,ishaan9543@gmail.com,7285012922,1979-10-01,"185, Shastri Nagar, Vishakhapatnam, Andhra Pradesh - 530064",5
charua7,7jvxbcrqHj!TA,Charu Ahmad,F,charua782@yahoo.com,8283108105,1959-04-15,"140, Indira Nagar, Patiala, Punjab - 147019",35
gau62,5w6$zkQ#y8fl,Gautam Jain,M,gau6241@hotmail.com,9575358989,1998-04-14,"85, Park Street, Bengaluru, Karnataka - 560000",15
ganesh7,gAjFL!o2E2D#Zu,Ganesh Khan,M,ganesh7@rediffmail.com,9422990158,1981-11-10,"163, Main Road, Solapur, Maharashtra - 413087",41
harin1,zSpxEOd0y7$w#,Harini Bhat,F,harin1@mail.com,7339577254,1999-02-07,"10, Ring Road, Kolhapur, Maharashtra - 416014",36
shanka72,2Z%9oUAa3t%UA8,Shankar Garg,M,shanka7246@outlook.com,9064162386,1983-01-13,"108, Ring Road, Bhopal, Madhya Pradesh - 462004",41
sun90,$zV!RI8rLDHs7q,Sunita Kumar,F,sun90.@outlook.com,6164549934,1991-01-09,"179, Rajiv Gandhi Road, Mangalore, Karnataka - 575058",23
neela59,f*KjWR3k,Neelam Syed,F,neela59.@yahoo.com,8188199876,2002-11-30,"199, Shastri Nagar, Bhopal, Madhya Pradesh - 462006",7
gane2,43#cjPj3kR,Ganesh Menon,M,gane225@hotmail.com,7197729075,1997-02-28,"75, New Colony, Chandigarh, Chandigarh - 160087",37
shr93,g3$TbH@@fVeNO5,Shreya Desai,F,shr9334@mail.com,8426641450,2002-04-13,"75, Indira Nagar, Patna, Bihar - 800017",10
rud75,lBK4M%7cP,Rudra Banerjee,M,rud75@rediffmail.com,6680161358,1976-07-24,"114, Park Street, Pune, Maharashtra - 411024",41
jayak89,L39McHQ2*aC,Jaya Kumar,F,jayak89.@outlook.com,6908430747,1971-10-09,"182, Indira Nagar, Guwahati, Assam - 781061",5
gita3,7vI6fvZ*0T91*G,Gita Shukla,F,gita377@hotmail.com,9989368172,1999-05-19,"8, Sector 14, Kolkata, West Bengal - 700016",34
amitba2,uRn3@m36,Amit Basu,M,amitba280@yahoo.com,7450515898,1970-09-07,"96, Market Road, Udaipur, Rajasthan - 313097",23
ais97,L2JDqZL?!,Aisha Kulkarni,F,ais97.@mail.com,7445482447,1966-10-25,"60, Sector 14, Noida, Uttar Pradesh - 201371",26
karan8,rufO!1yiph6J,Karan Chauhan,M,karan8.@gmail.com,6398805170,1987-11-11,"87, Old Town, Bhubaneswar, Odisha - 751063",23
snehas93,yF3n6?8$UIv3R?,Sneha Shukla,F,snehas93.@yahoo.com,7935966677,1976-08-18,"205, Market Road, Thane, Maharashtra - 400623",4
zoyame9,yiLN0@Ce?GXC,Zoya Menon,F,zoyame9@gmail.com,9145758185,1989-11-19,"73, S V Road, Surat, Gujarat - 395074",22
kavyag63,E#%h?Z5I@%p,Kavya Gupta,F,kavyag63@yahoo.com,8687584954,1966-03-05,"245, New Colony, Udaipur, Rajasthan - 313080",29
pra66,1U#7tkq8Y$7$u,Prateek Ahmad,M,pra66@mail.com,9786556018,1991-12-12,"164, Sector 14, Vadodara, Gujarat - 390094",6
lata70,b?8YOaf?iiXP,Lata Ahmad,F,lata708@outlook.com,8817849869,1988-03-09,"48, Civil Lines, Bhavnagar, Gujarat - 364047",31
nupurl0,qrg1kx*S1fR,Nupur Lal,F,nupurl0.@outlook.com,6149852594,1994-10-09,"104, Shastri Nagar, Cuttack, Odisha - 753085",7
rohanj8,3W@aJH1KS7!YD,Rohan Joshi,M,rohanj8@mail.com,9434466387,1982-02-19,"102, Main Road, Bhubaneswar, Odisha - 751044",26
zoy55,acv0iN$0@7S,Zoya Malhotra,F,zoy55.@mail.com,8393426709,1981-02-20,"188, Phase 1, Bengaluru, Karnataka - 560020",33
riti4,1xPXMRlO5byH@,Ritika Rangan,F,riti4@rediffmail.com,8619548884,1973-11-08,"87, Shastri Nagar, Indore, Madhya Pradesh - 452051",15
mad55,U94nosEg!,Madan Sinha,M,mad55.@mail.com,6168604458,1991-05-07,"174, Station Road, Udaipur, Rajasthan - 313044",43
monasi3,tLLjQp5zkT4*j,Mona Singh,F,monasi368@yahoo.com,6249496860,1991-05-27,"61, Park Street, Delhi, Delhi - 110005",49
radhi6,B5A!DUcpeS!SB,Radhika Suri,F,radhi672@hotmail.com,6805114113,1993-12-04,"233, New Colony, Patna, Bihar - 800042",44
laksh35,wC9E#GrZ,Lakshmi Shetty,F,laksh35@gmail.com,7706799336,1973-01-18,"189, Phase 1, Guwahati, Assam - 781064",47
anki9,s3*%I2DcBaO,Ankit Chandra,M,anki9.@hotmail.com,9755665662,2001-06-14,"204, MG Road, Vishakhapatnam, Andhra Pradesh - 530076",2
rupesh9,CX$v5thWr4%*5Z,Rupesh Mehta,M,rupesh9.@outlook.com,9395473405,2003-01-29,"114, Ring Road, Patna, Bihar - 800022",3
kira01,BNUtOe3!J3,Kiran Agarwal,F,kira01.@yahoo.com,6113024052,1985-11-04,"160, Ring Road, Gurgaon, Haryana - 122030",20
aditya4,xmhN*T98Dx!,Aditya Sinha,M,aditya4.@gmail.com,8522157608,1986-02-25,"192, MG Road, Raipur, Chhattisgarh - 492070",38
har98,jGg5z%?F,Harini Joshi,F,har98.@mail.com,8031088294,1997-04-19,"129, Phase 1, Hyderabad, Telangana - 500074",31
bhave95,*8b6$@W?f,Bhavesh Sharma,M,bhave95@hotmail.com,8115972698,2000-11-19,"19, Rajiv Gandhi Road, Udaipur, Rajasthan - 313094",34
madhur5,d*@C1cj$mM*,Madhuri Chatterjee,F,madhur5@gmail.com,9065861662,1977-11-20,"16, Park Street, Thiruvananthapuram, Kerala - 695035",48
ritu4,MW4V?PTHd,Ritu Chandra,F,ritu4@hotmail.com,8010787017,1967-04-06,"228, Market Road, Aligarh, Uttar Pradesh - 202072",48
neh69,8zt?8qcDBw,Neha Khan,F,neh69.@outlook.com,9526585026,1982-08-07,"79, Park Street, Hyderabad, Telangana - 500066",19
gaurir1,Z%#Gn8I#F8vPg3,Gauri Rangan,F,gaurir117@outlook.com,9073754735,1982-03-25,"225, Market Road, Noida, Uttar Pradesh - 201356",44
har33,#xk$oVzPeXkd?7,Harini Rangan,F,har33.@yahoo.com,6383169837,1974-11-27,"31, Market Road, Bilaspur, Chhattisgarh - 495029",2
tris6,@NP8E1@e!,Trisha Nambiar,F,tris6@hotmail.com,7668471801,1968-04-18,"239, Market Road, Vishakhapatnam, Andhra Pradesh - 530010",32
aja85,QJf63#?3J,Ajay Mehta,M,aja85@mail.com,8591798137,1969-07-04,"83, Civil Lines, Solapur, Maharashtra - 413030",30
chira9,YE3lKm%?%k,Chirag Singh,M,chira9.@mail.com,9060426873,1990-04-16,"49, Station Road, Rajkot, Gujarat - 360037",9
kav87,I4A@zb4a,Kavya Mehta,F,kav87.@hotmail.com,8925648632,1979-10-21,"202, S V Road, Vadodara, Gujarat - 390091",28
poo77,W4HzP%XX4j,Pooja Gupta,F,poo77.@rediffmail.com,7424921950,1976-11-24,"31, Park Street, Kochi, Kerala - 682012",39
smi04,F783jp@GrDvMA,Smita Ahmad,F,smi04@mail.com,7182849152,1997-07-04,"110, Ring Road, Jaipur, Rajasthan - 302072",14
rohan58,mv0pFcsry%$B,Rohan Kapoor,M,rohan58.@gmail.com,7910325070,1978-03-26,"65, New Colony, Thane, Maharashtra - 400690",45
sheet7,RozV0#%nQ65I@l,Sheetal Rao,F,sheet7@hotmail.com,9083490379,1960-02-09,"168, Market Road, Dehradun, Uttarakhand - 248071",32
sau88,vp!fah0L,Saurabh Joshi,M,sau8864@yahoo.com,6250079097,1980-06-08,"181, S V Road, Mangalore, Karnataka - 575008",43
rame60,3iTTAsUm6c$,Ramesh Sinha,M,rame6073@outlook.com,7896467394,1975-07-16,"197, Rajiv Gandhi Road, Bhopal, Madhya Pradesh - 462040",8
tan62,FxJLc46!CKSOM0,Tania Lal,F,tan6228@yahoo.com,9280313448,1989-06-17,"101, Shastri Nagar, Rajkot, Gujarat - 360082",22
vandan6,!66X7Suq3$ySZ4,Vandana Shukla,F,vandan6@mail.com,8304828095,1991-08-10,"137, Civil Lines, Chandigarh, Chandigarh - 160015",26
pra43,AFy?d3sbGQ1X4,Pranav Chandra,M,pra43.@mail.com,9289462979,1996-09-29,"10, Civil Lines, Dibrugarh, Assam - 786028",9
meerag1,EE4R$0*bNz8e,Meera Garg,F,meerag161@mail.com,9212842238,1991-04-21,"181, Sector 14, Vadodara, Gujarat - 390052",22
same0,OlxKfWe6ia0U?6,Sameer Tiwari,M,same077@rediffmail.com,8917294943,2003-04-23,"126, S V Road, Mumbai, Maharashtra - 400000",49
van82,BK%8uo3Us0@,Vandana Dutta,F,van8289@gmail.com,8864561858,1979-12-20,"202, Phase 1, Jodhpur, Rajasthan - 342082",48
ishaa68,Tb?b8?%!OI,Ishaan Nanda,M,ishaa6816@hotmail.com,7290196410,1972-10-25,"92, Indira Nagar, Patna, Bihar - 800093",1
ami27,k@*7@Zfb,Amit Tripathi,M,ami27@yahoo.com,6656763580,1969-03-01,"9, S V Road, Aligarh, Uttar Pradesh - 202029",23
latave9,y#3k7OE%5o,Lata Verma,F,latave9@mail.com,7784213951,1990-07-05,"166, Sector 14, Shillong, Meghalaya - 793067",34
ram05,I#94xNAsx60U,Ramesh Rao,M,ram05.@mail.com,8090949336,1976-11-14,"221, Main Road, Shillong, Meghalaya - 793050",4
jatinc7,zOIz88I*7y,Jatin Chatterjee,M,jatinc762@outlook.com,6002339536,1995-04-30,"230, Ring Road, Mangalore, Karnataka - 575098",7
diks57,YbP1!#pD#s2dz,Diksha Nair,F,diks57.@gmail.com,7249802357,1989-09-08,"160, Main Road, Guwahati, Assam - 781083",28
rahu3,My1?6Zaw$JPgI,Rahul Prasad,M,rahu3.@yahoo.com,6655258769,1964-02-25,"175, Phase 1, Jodhpur, Rajasthan - 342005",34
van03,gnUQgzC9Rdqod!,Vandana Lal,F,van03@rediffmail.com,7529574447,1982-06-28,"190, MG Road, Jaipur, Rajasthan - 302052",45
pran74,0ecI6sM#0F0,Pranav Verma,M,pran74.@hotmail.com,7356393695,1988-01-19,"24, Shastri Nagar, Patna, Bihar - 800038",26
vand29,Mz?NMUaO90A3z,Vandana Chatterjee,F,vand29.@yahoo.com,7922452960,1995-02-11,"236, Ring Road, Patiala, Punjab - 147079",21
kir73,z*1zT5TV3S2,Kiran Bhat,F,kir7351@mail.com,9622624243,1967-08-20,"247, Phase 1, Surat, Gujarat - 395038",17
vikra0,w#%F7RdnxzgQg,Vikram Kumar,M,vikra0.@yahoo.com,7875984914,1962-04-10,"33, Civil Lines, Vadodara, Gujarat - 390020",26
omk80,5KuT!e9Ey!,Omkar Suri,M,omk8045@rediffmail.com,9012398090,2001-06-03,"188, Rajiv Gandhi Road, Mysore, Karnataka - 570073",15
ish78,xhF8Dm#%4,Ishaan Reddy,M,ish78@outlook.com,8204430249,1989-12-02,"131, MG Road, Bhubaneswar, Odisha - 751041",30
neel4,dvFR$G3vB,Neelam Rao,F,neel4@hotmail.com,9979058462,1974-03-03,"94, Shastri Nagar, Patna, Bihar - 800075",15
amitm5,KwEudC!kGh85S,Amit Menon,M,amitm5@rediffmail.com,6100793357,1966-11-03,"156, Civil Lines, Kolkata, West Bengal - 700013",24
nikh0,5!i8yGW4a*u,Nikhil Jain,M,nikh0.@outlook.com,6117818822,2000-03-24,"115, New Colony, Hyderabad, Telangana - 500085",25
pratee0,z13eDq4*dx0p,Prateek Shah,M,pratee0.@mail.com,9068703769,1989-11-04,"190, Main Road, Lucknow, Uttar Pradesh - 226059",24
poojat8,7wS@i8G6,Pooja Tiwari,F,poojat8@yahoo.com,9780558706,1977-10-06,"215, MG Road, Vishakhapatnam, Andhra Pradesh - 530050",18
chirag0,6plEb#*3U,Chirag Reddy,M,chirag086@outlook.com,7658154679,1985-06-12,"8, Sector 14, Vishakhapatnam, Andhra Pradesh - 530046",39
mad81,qg#2$5D@5T,Madhuri Roy,F,mad8160@hotmail.com,9615574459,1983-04-25,"116, S V Road, Patiala, Punjab - 147028",40
vanda5,9t6Q1i%GyM,Vandana Ahmad,F,vanda5@rediffmail.com,6595220625,1977-06-12,"83, New Colony, Bengaluru, Karnataka - 560031",48
anan8,21!Uj$Nwr,Ananya Saxena,F,anan838@hotmail.com,6451150653,1958-09-22,"146, New Colony, Patna, Bihar - 800027",29
git34,uy?u6P7ffuxwi,Gita Rangan,F,git347@hotmail.com,6715843482,1975-11-24,"26, Phase 1, Varanasi, Uttar Pradesh - 221058",30
arvin0,bSYies3?@kX3,Arvind Khan,M,arvin014@gmail.com,9696218624,1986-10-18,"136, Ring Road, Kochi, Kerala - 682078",5
arjuna8,!Olt8#VS65,Arjun Agarwal,M,arjuna8@gmail.com,7323716508,1965-06-24,"64, New Colony, Coimbatore, Tamil Nadu - 641022",25
ganes6,EN!6AfVy?2b6r,Ganesh Rao,M,ganes6.@outlook.com,6306460792,1975-03-16,"173, Civil Lines, Kochi, Kerala - 682043",1
arv96,Y*LUNRdWQ7,Arvind Rao,M,arv96.@yahoo.com,8522725379,1975-01-03,"31, Ring Road, Agra, Uttar Pradesh - 282084",10
rah48,t*vBIu8%Q,Rahul Banerjee,M,rah48@rediffmail.com,6238361496,1969-02-07,"49, Shastri Nagar, Raipur, Chhattisgarh - 492011",42
kara5,l$5%dGK5t,Karan Mehta,M,kara5@outlook.com,9869193998,1972-04-04,"138, Phase 1, Patna, Bihar - 800040",29
madhu6,KB?!GdSLGu98D,Madhuri Singh,F,madhu6@yahoo.com,6830687749,1983-06-13,"206, Park Street, Mangalore, Karnataka - 575031",23
saks19,YM3Tx3W#p%l,Sakshi Prasad,F,saks19@outlook.com,6262946063,1979-02-09,"211, Station Road, Chennai, Tamil Nadu - 600076",38
kart2,OxGXT0I#6M1za,Kartik Gupta,M,kart2.@yahoo.com,6298936857,1982-12-07,"44, Park Street, Dibrugarh, Assam - 786095",22
sau30,b@y@sD6TW@,Saurabh Joshi,M,sau30.@mail.com,6930028912,1995-08-31,"125, Indira Nagar, Aligarh, Uttar Pradesh - 202058",3
kart81,8TCE$?Npo14v,Kartik Desai,M,kart81@gmail.com,8692989512,1996-10-03,"197, Main Road, Bilaspur, Chhattisgarh - 495075",17
ami82,cdr*5gfJerk,Amit Bhat,M,ami8282@outlook.com,9661055882,1969-07-08,"72, Civil Lines, Delhi, Delhi - 110066",17
navee1,?6dla1bN,Naveen Kulkarni,M,navee1.@hotmail.com,9517796129,1995-12-22,"119, Park Street, Aligarh, Uttar Pradesh - 202064",50
madanm58,z7eP2IE*nGf,Madan Mishra,M,madanm58@hotmail.com,8123598074,1978-01-14,"30, Market Road, Vadodara, Gujarat - 390056",32
kal67,%w0znwLP5N,Kalyani Kapoor,F,kal67@mail.com,8292344104,1964-09-13,"51, Sector 14, Guwahati, Assam - 781052",4
radhi32,0U$IjW@0WF,Radhika Lal,F,radhi32@mail.com,6907370114,1997-10-18,"172, Sector 14, Shillong, Meghalaya - 793050",18
amitr44,L4u%i@%eNri4,Amit Roy,M,amitr44.@outlook.com,6662741867,2001-04-28,"229, Ring Road, Jodhpur, Rajasthan - 342068",4
him72,#ZZ7oN%P,Himanshu Yadav,M,him7237@gmail.com,6960572102,1990-01-20,"98, Indira Nagar, Aligarh, Uttar Pradesh - 202035",8
pra02,Y3G49@okY,Prateek Dutta,M,pra02@gmail.com,8261896001,1994-01-25,"150, Civil Lines, Kolhapur, Maharashtra - 416000",9
ravil1,407N*ziM?DUCqv,Ravi Lal,M,ravil1.@yahoo.com,9793941635,1982-03-13,"149, Indira Nagar, Jamshedpur, Jharkhand - 831083",3
saur5,l8Y8!JVlxH$R,Saurabh Nair,M,saur5@hotmail.com,7274429525,1961-01-16,"110, Ring Road, Cuttack, Odisha - 753080",1
paru2,72#3xO4EI3M,Parul Khan,F,paru2.@yahoo.com,8297607086,1977-12-19,"216, New Colony, Lucknow, Uttar Pradesh - 226074",29
gauta97,1zPpOj3VSpVU!,Gautam Nair,M,gauta97@outlook.com,8573767368,2003-06-29,"45, Sector 14, Ahmedabad, Gujarat - 380077",32
zoya7,ieAb*2BTHto%,Zoya Chandra,F,zoya7@yahoo.com,9201001817,1972-07-12,"123, Shastri Nagar, Bengaluru, Karnataka - 560066",22
amri7,oPZ4Wpo?4@o,Amrita Garg,F,amri7.@gmail.com,6034701629,1992-07-28,"171, Shastri Nagar, Varanasi, Uttar Pradesh - 221037",22
rupes4,e!lF2MMA,Rupesh Reddy,M,rupes4.@outlook.com,7114199750,1972-05-06,"177, Sector 14, Udaipur, Rajasthan - 313069",39
arvind70,k!PR2fMe,Arvind Chatterjee,M,arvind7077@mail.com,8571288985,1999-09-05,"30, Sector 14, Guwahati, Assam - 781037",2
ank50,AGtb4a!$piY,Ankit Joshi,M,ank5088@hotmail.com,6550328493,1984-02-18,"101, Park Street, Udaipur, Rajasthan - 313045",22
bhave13,TU@V!V?r4,Bhavesh Iyer,M,bhave13.@gmail.com,9797849485,1995-08-20,"131, Old Town, Varanasi, Uttar Pradesh - 221089",24
esh06,t9Eg2uNOLq$,Esha Malhotra,F,esh06.@hotmail.com,7922952006,1976-01-10,"89, Station Road, Thane, Maharashtra - 400688",24
ritude91,%3oyY*GY,Ritu Desai,F,ritude91@gmail.com,7805368353,1970-09-23,"79, Park Street, Bhavnagar, Gujarat - 364033",2
esh98,Nf!Wuo9n!,Eshan Khan,M,esh9856@rediffmail.com,8669474978,1996-03-27,"7, Sector 14, Bengaluru, Karnataka - 560023",18
kun77,E7Xt#9vA,Kunal Tripathi,M,kun77.@mail.com,9787235452,2002-10-23,"18, Ring Road, Cuttack, Odisha - 753015",15
harish4,@o9f@76pKI5lv,Harish Mehta,M,harish438@hotmail.com,8934708619,1992-01-30,"2, Ring Road, Thane, Maharashtra - 400635",15
karan4,HX?747z#AP4,Karan Khanna,M,karan4.@hotmail.com,8890326555,2002-12-21,"37, Sector 14, Patiala, Punjab - 147037",10
roh63,5t%N2GSU,Rohan Prasad,M,roh63@hotmail.com,9845280215,1975-01-15,"211, Rajiv Gandhi Road, Varanasi, Uttar Pradesh - 221028",6
rahul03,%WR5knNfzIyh,Rahul Suri,M,rahul0374@yahoo.com,9702334692,1976-03-29,"183, Shastri Nagar, Ranchi, Jharkhand - 834057",48
yam69,mVQh*Y4Oi0,Yamini Pillai,F,yam69@outlook.com,8153194458,1962-05-12,"209, Rajiv Gandhi Road, Hyderabad, Telangana - 500006",32
fai76,7iXkxf?@c2TzLa,Faiz Upadhyay,M,fai76.@outlook.com,9276935273,1986-12-25,"173, Market Road, Patna, Bihar - 800002",16
indra9,e4$9ndqK!Y9U,Indrajit Nanda,M,indra9.@gmail.com,8920640523,1979-09-02,"194, Indira Nagar, Jaipur, Rajasthan - 302046",15
diksh4,GwpMO#7e,Diksha Ghosh,F,diksh4@hotmail.com,7575861789,1989-01-07,"240, New Colony, Kolkata, West Bengal - 700008",15
dinesh4,59IG99M9Pr4*Xo,Dinesh Kumar,M,dinesh4.@mail.com,6980746909,1993-02-17,"185, New Colony, Kolhapur, Maharashtra - 416030",1
smitaj8,Or4MZ@j42kI,Smita Joshi,F,smitaj860@gmail.com,9934091720,1961-11-22,"171, Phase 1, Kolkata, West Bengal - 700029",22
vandan2,RlsT1Tnq$%,Vandana Sinha,F,vandan2.@gmail.com,8242132978,1990-11-16,"202, Old Town, Pune, Maharashtra - 411084",37
radhi47,zB*Np3Zk,Radhika Sengupta,F,radhi47@rediffmail.com,7183734537,1998-08-28,"34, Civil Lines, Kolhapur, Maharashtra - 416044",18
vivekc2,fjOkp20%T,Vivek Chatterjee,M,vivekc2@yahoo.com,8076933124,1996-10-20,"166, New Colony, Udaipur, Rajasthan - 313053",39
