username,password,name,sex,email,mobile,dob,address,jobno
pava81,0NcW%rgvETZf,Pavan Upadhyay,M,pava816@hotmail.com,9143996566,1962-01-05,"10, Civil Lines, Patna, Bihar - 800018",14
faiz31,8N$#lFUSjrc#,Faiz Ahmad,M,faiz31.@outlook.com,6922564309,1982-07-07,"223, Shastri Nagar, Lucknow, Uttar Pradesh - 226020",25
ani58,vsZZpy%tdgN1,Anirudh Mehta,M,ani58@yahoo.com,9529637644,1997-05-19,"205, Sector 14, Guwahati, Assam - 781052",28
ash43,cN1gU*fq,Ashok Menon,M,ash43.@rediffmail.com,6469777727,1961-10-19,"115, Park Street, Rajkot, Gujarat - 360068",34
prana5,zNrh@@6p,Pranav Reddy,M,prana51@mail.com,9239680464,1989-12-01,"158, Sector 14, Mumbai, Maharashtra - 400033",1
sheeta0,pHP1kg%TJki,Sheetal Desai,F,sheeta0.@yahoo.com,7343811037,1960-11-01,"171, Civil Lines, Bhopal, Madhya Pradesh - 462099",18
yashna73,0@mq*h8hIYbA6k,Yash Nanda,M,yashna73@mail.com,7278928178,2003-01-25,"47, Civil Lines, Jamshedpur, Jharkhand - 831095",41
nikh0,nnAE7K0W%,Nikhil Iyer,M,nikh0@hotmail.com,6223430007,1977-01-07,"121, Ring Road, Nagpur, Maharashtra - 440091",12
jayad1,y?Ko1w7Az8SvZ,Jaya Dutta,F,jayad1@rediffmail.com,8347511478,1989-02-28,"115, New Colony, Shillong, Meghalaya - 793079",5
cha56,JZ9V2!BbV,Charu Mishra,F,cha5652@hotmail.com,7112687475,1985-03-22,"76, Old Town, Chandigarh, Chandigarh - 160021",15
bhave6,Eo*i0*SiR?,Bhavesh Bhat,M,bhave6@mail.com,6829195977,1967-07-20,"191, Old Town, Bilaspur, Chhattisgarh - 495036",41
rajes2,4FHY@DymZE6kI,Rajesh Saxena,M,rajes2.@yahoo.com,9991578630,1959-03-21,"240, MG Road, Kolhapur, Maharashtra - 416017",18
him91,019s@4HjLqKwv,Himanshu Shetty,M,him91@outlook.com,9162838811,1967-11-18,"27, Ring Road, Chandigarh, Chandigarh - 160036",8
shre4,f6@sT8R9Vt,Shreya Patel,F,shre4@outlook.com,9774059209,1974-04-26,"91, Main Road, Thane, Maharashtra - 400644",27
kavy4,KXK7f1Rp3r%,Kavya Suri,F,kavy4@gmail.com,8387148594,1976-11-27,"15, Old Town, Chandigarh, Chandigarh - 160019",46
ani93,vDaOqk!Gj5k9C,Anirudh Chandra,M,ani93@yahoo.com,6807508685,1981-02-24,"129, Ring Road, Varanasi, Uttar Pradesh - 221074",11
shreya7,Z4mb$6T3GMv,Shreya Mishra,F,shreya7@hotmail.com,8025057356,1960-11-26,"69, Station Road, Patna, Bihar - 800095",37
nehak9,$IyyLAv4,Neha Kumar,F,nehak9@gmail.com,9480160692,1977-05-07,"168, Park Street, Udaipur, Rajasthan - 313071",33
esha2,jfNQ36@IkbRo,Esha Garg,F,esha236@hotmail.com,8017242861,1969-02-14,"125, MG Road, Varanasi, Uttar Pradesh - 221032",27
rajes0,W2*kQ*M4dco,Rajesh Dutta,M,rajes0@hotmail.com,9458111934,1994-01-09,"17, Main Road, Bhubaneswar, Odisha - 751036",14
aisham5,Neu33?12*E#,Aisha Malhotra,F,aisham5@gmail.com,8427856280,1996-06-12,"247, Shastri Nagar, Bhubaneswar, Odisha - 751021",27
hari49,4X9Tj?aN8MnY,Harini Khan,F,hari4934@mail.com,6998665071,1972-11-25,"97, Civil Lines, Rajkot, Gujarat - 360039",44
sha85,wD5@*Cx?Fyz7*D,Shankar Dutta,M,sha85@gmail.com,6644790450,1984-01-04,"55, Civil Lines, Gurgaon, Haryana - 122075",8
navin4,as!!#wvT16!UUJ,Navin Iyer,M,navin425@mail.com,9885169195,1997-03-29,"26, Old Town, Chandigarh, Chandigarh - 160085",41
gitam13,b6OWC!Ra,Gita Menon,F,gitam13@mail.com,7252777629,1960-01-29,"149, Indira Nagar, Solapur, Maharashtra - 413014",39
karan8,25o?pCgC,Karan Chatterjee,M,karan8.@yahoo.com,7296681339,1958-06-14,"134, Old Town, Bhopal, Madhya Pradesh - 462021",39
bhav8,Y@#p5Gas,Bhavesh Singh,M,bhav856@outlook.com,7218791751,1976-06-19,"125, Phase 1, Bilaspur, Chhattisgarh - 495084",48
pri31,$5l1uOLJcu,Priti Nambiar,F,pri31@gmail.com,7637130347,1978-11-15,"17, Phase 1, Dehradun, Uttarakhand - 248022",14
chi84,53IDw@kN?AilNn,Chirag Malhotra,M,chi84.@gmail.com,9727453636,1998-10-13,"218, New Colony, Patiala, Punjab - 147091",24
ami19,r@z?#!6!n72lWx,Amit Saxena,M,ami19@hotmail.com,7789441556,1983-03-03,"198, Old Town, Raipur, Chhattisgarh - 492040",50
bhavn82,o!hgXma1o*eO4,Bhavna Gupta,F,bhavn82.@rediffmail.com,7712138618,1967-11-21,"5, Rajiv Gandhi Road, Patna, Bihar - 800042",31
rad04,MxAEdq6%z,Radhika Pillai,F,rad0468@outlook.com,9102118525,1982-09-18,"226, S V Road, Chandigarh, Chandigarh - 160064",26
nikhi2,vPGWg*vG!IYq4l,Nikhil Chandra,M,nikhi2@yahoo.com,6595421859,1978-06-25,"129, Park Street, Ludhiana, Punjab - 141077",7
aparna7,77a9y#!IzvX1,Aparna Rao,F,aparna7@rediffmail.com,9371969868,1998-04-22,"45, Ring Road, Ludhiana, Punjab - 141093",22
rituj1,Q?D2wFtQI%5%,Ritu Jain,F,rituj1.@gmail.com,9025034602,1989-06-02,"202, Indira Nagar, Nagpur, Maharashtra - 440059",36
arjun9,#s4pG1NRy,Arjun Sengupta,M,arjun9.@rediffmail.com,7611530565,1991-09-24,"25, Park Street, Vishakhapatnam, Andhra Pradesh - 530056",33
gaurig4,Q0JDa!O%uq8,Gauri Ghosh,F,gaurig460@outlook.com,6029158568,1968-11-23,"150, New Colony, Dibrugarh, Assam - 786057",45
arvind2,h4V?avaUHiP*e,Arvind Chatterjee,M,arvind2.@outlook.com,7885868646,1974-07-31,"210, Old Town, Lucknow, Uttar Pradesh - 226061",48
navin6,Gk3i$l4A4PAt,Navin Sinha,M,navin6.@rediffmail.com,7373063737,1970-07-25,"201, Shastri Nagar, Vadodara, Gujarat - 390069",5
madh75,2wdQgBy*$k6Qi,Madhuri Sinha,F,madh75.@gmail.com,6618076893,1998-04-30,"35, New Colony, Thane, Maharashtra - 400651",17
eshal2,3oq3O!URN,Esha Lal,F,eshal288@mail.com,9128538884,1991-09-29,"146, Station Road, Chennai, Tamil Nadu - 600015",7
rup50,Qvk8*6JJytqiQK,Rupesh Saxena,M,rup50@yahoo.com,7579682099,1961-03-04,"19, Phase 1, Guwahati, Assam - 781056",6
kav05,1178np#A#bLPn,Kavya Malhotra,F,kav05@gmail.com,9169339200,1995-01-22,"193, Rajiv Gandhi Road, Dibrugarh, Assam - 786085",3
nav04,uqB5%HPTik,Naveen Bhat,M,nav04.@hotmail.com,8828351349,2001-08-15,"21, Civil Lines, Vadodara, Gujarat - 390098",34
asho3,0Stfe5@IAZhFcW,Ashok Shukla,M,asho3.@rediffmail.com,6607997382,1977-06-05,"88, Old Town, Delhi, Delhi - 110084",28
karana92,J@lOZA9b*nNj,Karan Ahmad,M,karana92.@mail.com,8786153214,1997-06-19,"120, MG Road, Mumbai, Maharashtra - 400094",36
yas85,?prIO2f4,Yash Kumar,M,yas8524@rediffmail.com,9507072268,1989-09-13,"184, MG Road, Ranchi, Jharkhand - 834063",5
ais25,bz*yn*P9$Dut1V,Aisha Bhattacharya,F,ais25.@rediffmail.com,6617699959,1995-07-05,"188, Station Road, Ranchi, Jharkhand - 834085",4
yamini2,hS3qqyY#Fyj8Z0,Yamini Mishra,F,yamini253@rediffmail.com,7673145148,1975-10-10,"225, Sector 14, Indore, Madhya Pradesh - 452001",17
apar8,WADfJK@1,Aparna Mehta,F,apar8.@hotmail.com,6907344482,2000-10-20,"35, Old Town, Aligarh, Uttar Pradesh - 202017",33
deepa63,9#xFMq9Og$u,Deepak Sharma,M,deepa6356@hotmail.com,8021248299,1967-07-10,"171, Ring Road, Chandigarh, Chandigarh - 160012",33
ami51,#N#5hA3uYJl,Amit Shetty,M,ami51@mail.com,7735265773,1961-06-10,"26, Rajiv Gandhi Road, Vishakhapatnam, Andhra Pradesh - 530075",13
him13,nk44YtV$g,Himanshu Menon,M,him13@gmail.com,9666235988,1984-03-17,"125, Sector 14, Jodhpur, Rajasthan - 342073",23
seem9,WTwWjH6wY$hhG1,Seema Mehta,F,seem934@hotmail.com,9343927383,1994-10-07,"147, Rajiv Gandhi Road, Chandigarh, Chandigarh - 160012",41
ganes6,6y!01Xwa,Ganesh Nambiar,M,ganes621@outlook.com,7213452087,1967-03-14,"102, Shastri Nagar, Amritsar, Punjab - 143041",20
nikh2,6@8m4fZ7,Nikhil Menon,M,nikh225@hotmail.com,8473409534,1977-12-09,"144, Ring Road, Gurgaon, Haryana - 122049",35
anirud33,bEW1N@h7Gjdv,Anirudh Singh,M,anirud3352@outlook.com,7044780658,1982-01-21,"54, Shastri Nagar, Aligarh, Uttar Pradesh - 202054",32
vanda7,niJ8!Df1aiRx,Vandana Bhat,F,vanda7@hotmail.com,6429656361,1976-05-05,"244, Old Town, Jamshedpur, Jharkhand - 831036",31
suni5,?RmgFPag$WGa5n,Sunita Rao,F,suni575@hotmail.com,8642560172,1981-08-03,"27, Park Street, Varanasi, Uttar Pradesh - 221075",50
neela86,pGaj#o?Q0Gf,Neelam Syed,F,neela8631@outlook.com,9773830621,1982-12-01,"37, Indira Nagar, Bhavnagar, Gujarat - 364044",45
zoyaiy30,nQ8zyD5@*O,Zoya Iyer,F,zoyaiy30@hotmail.com,8502663972,1963-02-19,"211, MG Road, Varanasi, Uttar Pradesh - 221089",39
jayade87,if5E5mWXD!Q6bX,Jaya Desai,F,jayade87@mail.com,9460171210,1975-10-29,"130, Phase 1, Aligarh, Uttar Pradesh - 202017",1
ishaa3,blgm9vRcf@$W,Isha Ahmad,F,ishaa3@outlook.com,8113218126,1981-09-25,"126, Main Road, Hyderabad, Telangana - 500053",42
umal9,WWMx3o8%2eoI,Uma Lal,F,umal967@mail.com,7443569313,1958-09-16,"108, Sector 14, Bhopal, Madhya Pradesh - 462036",7
same5,P9VAHcGOXYoqB$,Sameer Kapoor,M,same539@mail.com,7951670071,1989-01-19,"102, Park Street, Mangalore, Karnataka - 575046",13
ash22,X21kaM*h,Ashok Kapoor,M,ash2260@yahoo.com,6339332685,1964-06-06,"126, New Colony, Guwahati, Assam - 781075",15
rudra3,9dfu?AtmkAIgpB,Rudra Bhat,M,rudra345@mail.com,6648115606,1994-01-15,"198, MG Road, Vishakhapatnam, Andhra Pradesh - 530032",41
faizsu34,1lRD80f?ma,Faiz Suri,M,faizsu34@gmail.com,9405346702,1984-04-22,"107, MG Road, Guwahati, Assam - 781042",3
sam72,92R*djIx,Sameer Chandra,M,sam72.@gmail.com,7678157363,1993-12-14,"48, Old Town, Delhi, Delhi - 110026",6
aish23,3*ztE0z3GZR1,Aisha Garg,F,aish23.@mail.com,7247602726,1999-04-30,"108, New Colony, Agra, Uttar Pradesh - 282055",31
rames8,A@lTO7KBx,Ramesh Rao,M,rames8.@hotmail.com,9606134909,2002-01-11,"97, Rajiv Gandhi Road, Patna, Bihar - 800053",8
gaut5,CPF%6CwyZ,Gautam Kulkarni,M,gaut5.@hotmail.com,9184087660,1995-07-06,"106, Civil Lines, Gurgaon, Haryana - 122066",9
faizsy3,zFg78sZ*T,Faiz Syed,M,faizsy3.@mail.com,7328242697,1999-05-25,"165, Station Road, Amritsar, Punjab - 143088",11
pra76,2%p8X!6?PLQ,Prateek Chandra,M,pra76@gmail.com,7875773612,2001-04-18,"68, Station Road, Kochi, Kerala - 682036",30
gitab2,K*c7jz8Krsb,Gita Bhat,F,gitab2.@yahoo.com,7123602352,2003-08-18,"223, Market Road, Dibrugarh, Assam - 786046",11
vanda38,xpaU9$8$fvm,Vandana Chatterjee,F,vanda38@hotmail.com,6303055789,1963-01-09,"146, Market Road, Coimbatore, Tamil Nadu - 641022",48
laks6,b9Kg5nMe!#F,Lakshay Rangan,M,laks641@gmail.com,7444055204,1968-01-03,"227, Sector 14, Bilaspur, Chhattisgarh - 495071",41
priyap26,M8uQ#s7pr$,Priya Pillai,F,priyap26@yahoo.com,6760836811,1978-10-18,"79, Market Road, Kochi, Kerala - 682037",31
kart63,JYGT?2mkw,Kartik Kapoor,M,kart63.@mail.com,8833570904,1970-07-22,"197, Ring Road, Mangalore, Karnataka - 575007",14
see43,xwHqIo3?X7Rh,Seema Dutta,F,see438@hotmail.com,8542480978,1971-06-30,"77, S V Road, Agra, Uttar Pradesh - 282010",16
parul52,?E21vyX6,Parul Khan,F,parul52.@hotmail.com,7672701434,1962-04-23,"16, Rajiv Gandhi Road, Ludhiana, Punjab - 141093",37
nehab45,J6C1GMSkghNx%,Neha Bhattacharya,F,nehab4583@hotmail.com,9568405080,1978-03-17,"110, Park Street, Raipur, Chhattisgarh - 492022",44
mona98,KeSg3$ekcyi?v,Mona Chauhan,F,mona98@outlook.com,6834773432,1992-02-20,"209, Station Road, Agra, Uttar Pradesh - 282001",38
anki9,3Try5h$anF*l3,Ankit Upadhyay,M,anki984@outlook.com,9097808105,1970-07-31,"121, Shastri Nagar, Aligarh, Uttar Pradesh - 202005",14
ananya4,v#elQ2I8h,Ananya Nambiar,F,ananya4@mail.com,7903551080,1963-12-14,"248, Sector 14, Ahmedabad, Gujarat - 380044",35
kav48,%5IEUkgN#8,Kavya Shetty,F,kav48.@hotmail.com,6227374559,1981-12-06,"84, Phase 1, Jaipur, Rajasthan - 302031",48
omkars01,0eAwN2H?l,Omkar Suri,M,omkars01.@rediffmail.com,9127938284,1998-12-09,"25, New Colony, Jodhpur, Rajasthan - 342087",17
sha12,fuED78d*v8*,Shankar Prasad,M,sha1268@yahoo.com,6832953116,1978-04-20,"39, Market Road, Bhavnagar, Gujarat - 364096",13
anjal9,5XUu@WYfPoo,Anjali Khanna,F,anjal921@outlook.com,9523291475,1971-08-16,"114, Park Street, Kochi, Kerala - 682067",1
arv52,$X808*kdQ8J,Arvind Kapoor,M,arv52.@yahoo.com,6079828474,1963-01-31,"27, Indira Nagar, Solapur, Maharashtra - 413078",47
smita6,cH0L!sXODp,Smita Menon,F,smita676@gmail.com,6173694373,1997-06-30,"147, Indira Nagar, Mangalore, Karnataka - 575059",41
yami16,FjVy6D9yb?,Yamini Singh,F,yami16@yahoo.com,8777140358,1978-06-02,"213, Ring Road, Raipur, Chhattisgarh - 492017",41
pritin13,5W#p9%0w3h,Priti Nambiar,F,pritin13@gmail.com,9813313878,1984-05-14,"146, Station Road, Jamshedpur, Jharkhand - 831032",3
chira4,W?hEuE3HM7%3k@,Chirag Chatterjee,M,chira4@hotmail.com,8063877509,2003-07-12,"122, Market Road, Bhavnagar, Gujarat - 364038",39
nave2,xl9$$M7BkMIoEd,Naveen Ghosh,M,nave2@mail.com,9363275479,1986-03-19,"249, S V Road, Mumbai, Maharashtra - 400007",38
rud41,2tHmS?igI,Rudra Reddy,M,rud41@hotmail.com,8142022360,1998-07-12,"135, Ring Road, Pune, Maharashtra - 411006",36
kar09,M7A#b!k6,Kartik Dutta,M,kar09@mail.com,7558781180,1961-06-24,"228, Shastri Nagar, Ranchi, Jharkhand - 834098",20
divy59,#@GLiE2%#tA,Divya Ghosh,F,divy59.@gmail.com,9897805635,1993-05-13,"165, Civil Lines, Ranchi, Jharkhand - 834021",49
vivekm4,a7!IPHAw,Vivek Menon,M,vivekm440@mail.com,7675031908,1996-12-01,"131, Market Road, Dibrugarh, Assam - 786085",44
aditya8,@VaoocK@q$b3S,Aditya Mehta,M,aditya855@rediffmail.com,8287264429,2001-10-19,"154, MG Road, Surat, Gujarat - 395063",45
kavy6,Fz!wrm7$,Kavya Tiwari,F,kavy6@outlook.com,7954194128,1974-07-20,"196, Old Town, Hyderabad, Telangana - 500082",40
esha5,?Vo$q3Nv,Esha Shukla,F,esha5@outlook.com,9120116480,1980-01-19,"136, Ring Road, Rajkot, Gujarat - 360051",21
rah50,V5ac#!NxaeFA7,Rahul Lal,M,rah5058@yahoo.com,9639491531,1973-08-23,"66, Rajiv Gandhi Road, Thane, Maharashtra - 400617",28
ritika7,H8FR$Fm?2BFo,Ritika Patel,F,ritika760@outlook.com,8621163876,1962-07-26,"56, Main Road, Thiruvananthapuram, Kerala - 695051",25
sne25,9IkCxB1?n,Sneha Tripathi,F,sne25@gmail.com,6098309379,1985-08-05,"93, S V Road, Chennai, Tamil Nadu - 600095",29
neel3,MCG*KV@Q!Rfk2*,Neelam Sengupta,F,neel357@rediffmail.com,7404633031,1984-12-03,"101, Rajiv Gandhi Road, Udaipur, Rajasthan - 313019",43
himan77,Q!?OJz7zTr,Himanshu Agarwal,M,himan77.@outlook.com,8077405196,1959-09-22,"98, Civil Lines, Cuttack, Odisha - 753093",3
kriti8,TxMXsf@*@6ZnH$,Kriti Shah,F,kriti8@gmail.com,6739059963,1967-06-30,"32, MG Road, Jamshedpur, Jharkhand - 831071",48
pra46,G$wBwK?n1,Pranav Gupta,M,pra46@gmail.com,7928511718,1978-06-06,"102, New Colony, Bhopal, Madhya Pradesh - 462082",27
sunit7,#Y4Qe40euAxf,Sunita Prasad,F,sunit7.@outlook.com,8744739150,1989-08-29,"120, Rajiv Gandhi Road, Gurgaon, Haryana - 122049",26
gaur7,aa?vBRN?2T2,Gauri Tripathi,F,gaur7@gmail.com,9339524749,1972-05-04,"249, New Colony, Patiala, Punjab - 147009",5
bhavn2,ZD$kgiRvaV6,Bhavna Sinha,F,bhavn2@outlook.com,8423283997,1988-07-27,"204, Main Road, Varanasi, Uttar Pradesh - 221069",21
mada4,$A!k8!FwKkA,Madan Basu,M,mada4@yahoo.com,6384123965,1974-11-19,"155, Station Road, Rajkot, Gujarat - 360020",13
nishag7,4AS@fk!MRjjb0G,Nisha Garg,F,nishag7@hotmail.com,6185337566,1993-06-26,"84, S V Road, Indore, Madhya Pradesh - 452080",19
par07,qkc#1@P0K,Parul Upadhyay,F,par07@rediffmail.com,9631884192,1979-06-20,"166, New Colony, Kolkata, West Bengal - 700050",45
nav79,qBC5AtXRnJbe#E,Navin Patel,M,nav79@yahoo.com,6972551263,1987-05-06,"101, Station Road, Surat, Gujarat - 395064",29
sun31,Ry959gUNd9G4*Z,Sunita Desai,F,sun31.@outlook.com,9614529826,1958-01-09,"159, MG Road, Delhi, Delhi - 110089",1
esha0,bfUC*618g,Esha Shah,F,esha0@gmail.com,6028552747,1971-10-03,"17, Phase 1, Kochi, Kerala - 682060",32
gaur5,b4V*Hc3t,Gauri Jain,F,gaur5.@rediffmail.com,9777203853,1991-04-23,"142, Market Road, Bilaspur, Chhattisgarh - 495017",23
snehab4,jYUf?C%92U,Sneha Basu,F,snehab4.@rediffmail.com,7558171826,1965-05-02,"226, Station Road, Gurgaon, Haryana - 122095",34
dines61,YwBVL5i$2,Dinesh Sharma,M,dines6120@yahoo.com,6897496373,1976-10-09,"164, Station Road, Ranchi, Jharkhand - 834091",2
vive8,Dcy$4$WoCDABu,Vivek Iyer,M,vive8.@outlook.com,6458969397,1965-10-16,"65, Market Road, Mysore, Karnataka - 570002",46
prate6,76o4%i1kCaB,Prateek Shah,M,prate669@mail.com,6215148064,1971-11-21,"51, Sector 14, Chennai, Tamil Nadu - 600040",50
rud13,3$p*ZEhEjS!MW,Rudra Shah,M,rud13.@rediffmail.com,9008645291,1960-03-01,"23, S V Road, Bhopal, Madhya Pradesh - 462011",43
nupurp9,jh!q6sk2FWaMe,Nupur Pillai,F,nupurp925@outlook.com,9403658115,1964-02-07,"132, Station Road, Mysore, Karnataka - 570052",49
umad4,5zbnHN$B?5!pYF,Uma Dutta,F,umad4@mail.com,7702269386,1985-08-24,"131, Sector 14, Mysore, Karnataka - 570038",45
nav43,T8u1pP@wqR##,Navin Rao,M,nav4386@yahoo.com,7861675245,1968-07-07,"186, Rajiv Gandhi Road, Bilaspur, Chhattisgarh - 495022",39
snehar2,*4k9rP%L$iW,Sneha Rangan,F,snehar2.@gmail.com,9641431179,1961-09-06,"72, Station Road, Chennai, Tamil Nadu - 600052",7
sun19,6QkMpsjIMvN6@,Sunita Patel,F,sun19@outlook.com,7268920648,1992-09-10,"55, Civil Lines, Coimbatore, Tamil Nadu - 641010",46
eshach70,2gIKI5WQ$P7wPz,Esha Chatterjee,F,eshach70.@rediffmail.com,9965607053,1959-11-03,"112, Old Town, Patiala, Punjab - 147044",28
radhi9,632Pf*6@PS,Radhika Saxena,F,radhi9@rediffmail.com,8428292352,1966-04-12,"14, S V Road, Jamshedpur, Jharkhand - 831067",48
viveka8,%Aehm3X4z,Vivek Ahmad,M,viveka8@hotmail.com,7750501011,1990-12-11,"201, Ring Road, Varanasi, Uttar Pradesh - 221044",46
mada60,9aE$K4L0HYG,Madan Bhat,M,mada60@yahoo.com,6532643331,1959-06-10,"112, Shastri Nagar, Kochi, Kerala - 682061",38
indra2,zXoBoH$4,Indrajit Garg,M,indra2.@gmail.com,8436453549,2001-01-05,"91, Main Road, Chennai, Tamil Nadu - 600019",11
karan0,!5qxwEQUx,Karan Chatterjee,M,karan056@gmail.com,6918377617,1975-08-13,"158, Phase 1, Hyderabad, Telangana - 500022",3
priy5,oYlNZc?6?%e,Priya Nair,F,priy544@mail.com,8892588365,1983-01-11,"200, Rajiv Gandhi Road, Rajkot, Gujarat - 360028",28
ishar9,B8r7kp?h2s4,Isha Rao,F,ishar9@yahoo.com,7696790444,1960-09-29,"241, Main Road, Bhubaneswar, Odisha - 751012",32
rituku8,fkfwt2#A2H,Ritu Kulkarni,F,rituku8@yahoo.com,8936835083,1961-06-30,"22, MG Road, Agra, Uttar Pradesh - 282068",13
gau56,VgteW@PS4PrC,Gautam Nanda,M,gau56@hotmail.com,8247008191,1964-08-03,"198, Main Road, Nagpur, Maharashtra - 440065",46
dik66,jST6$dA34zA3x,Diksha Jain,F,dik66@hotmail.com,9083015422,1974-03-13,"10, Shastri Nagar, Gurgaon, Haryana - 122003",22
nee79,Te59GYKI*,Neelam Sharma,F,nee79.@gmail.com,8346748996,1978-09-20,"214, S V Road, Raipur, Chhattisgarh - 492022",42
nikhi2,BL%3bs?4E3HD,Nikhil Tiwari,M,nikhi250@mail.com,8160432409,1981-03-01,"169, Ring Road, Bhopal, Madhya Pradesh - 462064",28
navee7,*6qJa*8r8e,Naveen Banerjee,M,navee7@outlook.com,8730185209,1965-10-02,"42, Park Street, Chennai, Tamil Nadu - 600035",45
navin3,B3ZO16HQl!y,Navin Upadhyay,M,navin3@gmail.com,8063370341,1966-08-11,"134, Market Road, Rajkot, Gujarat - 360075",31
nupur6,@7vuu45Z,Nupur Ahmad,F,nupur6.@outlook.com,6934740210,1970-05-01,"155, S V Road, Ludhiana, Punjab - 141083",7
kalya1,0@!S1v0dz,Kalyani Rao,F,kalya1.@gmail.com,8200951443,1967-08-04,"41, S V Road, Surat, Gujarat - 395098",16
rame97,zWl0pU%$,Ramesh Banerjee,M,rame9764@yahoo.com,6463821945,1982-03-02,"158, Indira Nagar, Patna, Bihar - 800087",17
priyai12,9rX%p!rfS,Priya Iyer,F,priyai12@mail.com,7780121778,1987-03-03,"97, New Colony, Gurgaon, Haryana - 122052",43
hima3,FFastV$9ee3Hvd,Himanshu Chatterjee,M,hima3.@mail.com,7462431290,1979-01-12,"125, Phase 1, Kolhapur, Maharashtra - 416029",33
rahul20,e%B*q7qV%h4!#r,Rahul Malhotra,M,rahul20.@yahoo.com,7137285669,1990-01-07,"98, Sector 14, Pune, Maharashtra - 411068",21
ramesh5,8!HV9ohp7Cn,Ramesh Ghosh,M,ramesh5@hotmail.com,6949688096,1966-05-23,"203, S V Road, Surat, Gujarat - 395056",49
vikra17,?gyCyDwtpA3@O,Vikram Sinha,M,vikra17@mail.com,7121462119,1976-04-26,"161, Shastri Nagar, Shillong, Meghalaya - 793082",44
rit40,fBrC6Dk2*f,Ritika Roy,F,rit4077@mail.com,7946722277,1959-10-19,"104, Ring Road, Thiruvananthapuram, Kerala - 695035",6
lak75,pYjDO!7iJ!$rJL,Lakshay Nair,M,lak7543@yahoo.com,7048176014,1995-11-15,"163, Market Road, Bilaspur, Chhattisgarh - 495007",30
karti0,03w?0cYa,Kartik Malhotra,M,karti069@hotmail.com,6776793675,1984-01-03,"67, Park Street, Nagpur, Maharashtra - 440008",39
see17,TD#P0Abazqsc,Seema Nanda,F,see17@yahoo.com,9122363873,1961-10-04,"183, MG Road, Dehradun, Uttarakhand - 248060",14
yashsh39,rT3e@y@#78Y9Ki,Yash Shetty,M,yashsh3968@gmail.com,9210662156,1985-08-03,"77, Park Street, Gurgaon, Haryana - 122008",49
shanka1,m$kcIcR7$Azu?8,Shankar Chandra,M,shanka1.@hotmail.com,8595902126,1974-01-04,"85, Old Town, Vadodara, Gujarat - 390094",45
karti2,5oW0BB@yrvj3@,Kartik Roy,M,karti231@gmail.com,7416904000,2003-04-19,"195, Main Road, Patiala, Punjab - 147090",33
kal92,5xL9!CaZ,Kalyani Ahmad,F,kal9234@hotmail.com,6999863638,1964-11-03,"155, Station Road, Cuttack, Odisha - 753088",41
divya2,nko0PPkk?j4%,Divya Khan,F,divya217@rediffmail.com,9903072949,1962-02-28,"178, Station Road, Ludhiana, Punjab - 141011",50
vik83,mg0$cZkwTpF,Vikram Joshi,M,vik8363@outlook.com,9761252702,1958-06-12,"115, Shastri Nagar, Ludhiana, Punjab - 141012",31
yash6,PMVdd!FX0zWU,Yash Patel,M,yash699@rediffmail.com,9868677678,1966-01-16,"76, Park Street, Ludhiana, Punjab - 141053",25
dee05,3thp39@S15,Deepak Rao,M,dee05@outlook.com,9904739752,1990-06-17,"63, Rajiv Gandhi Road, Kolhapur, Maharashtra - 416091",36
vivek8,Ec%w29D3,Vivek Sharma,M,vivek812@outlook.com,9369258088,1975-01-27,"81, S V Road, Ludhiana, Punjab - 141039",8
meera5,Rz4%JcS?c,Meera Yadav,F,meera5@gmail.com,6875068398,1962-04-20,"97, Market Road, Chennai, Tamil Nadu - 600006",6
uma34,9Edus@$RRF8S8z,Uma Shetty,F,uma34@rediffmail.com,6746430166,1981-08-23,"102, Rajiv Gandhi Road, Delhi, Delhi - 110055",5
saurab0,%L2xflh@K,Saurabh Joshi,M,saurab0.@gmail.com,7725614531,1977-07-31,"20, Rajiv Gandhi Road, Coimbatore, Tamil Nadu - 641062",17
navee1,ghJr?t?0qoq,Naveen Banerjee,M,navee1@mail.com,6885811591,1988-07-07,"213, Sector 14, Dibrugarh, Assam - 786076",29
pava21,52Oc$Fpb%rXZ,Pavan Prasad,M,pava21@gmail.com,8731612360,1993-04-16,"224, New Colony, Udaipur, Rajasthan - 313037",35
divya5,V2jqC%K*0M$N!,Divya Lal,F,divya5@rediffmail.com,7659565218,1988-04-19,"157, Market Road, Dibrugarh, Assam - 786050",6
radhik6,@l2B1CbA9nT,Radhika Tripathi,F,radhik664@rediffmail.com,9316957183,1975-08-07,"192, MG Road, Patiala, Punjab - 147075",44
gaut62,i0?W9*Ay,Gautam Rangan,M,gaut62.@rediffmail.com,7733293513,1984-05-23,"164, Civil Lines, Indore, Madhya Pradesh - 452061",35
bhav99,wKf2m#KU,Bhavya Saxena,F,bhav99@outlook.com,7825732955,1993-02-05,"94, MG Road, Shillong, Meghalaya - 793094",17
nup34,iHN@hinRJ!J3U,Nupur Agarwal,F,nup34.@hotmail.com,6343317388,2000-09-09,"217, Market Road, Bilaspur, Chhattisgarh - 495007",29
nehas6,?QOycdi2GF4$Z,Neha Singh,F,nehas6.@rediffmail.com,9498547528,1970-05-27,"181, Main Road, Patiala, Punjab - 147059",43
monam59,!wD%4zj%#im96K,Mona Menon,F,monam59@gmail.com,8302651138,1992-05-14,"151, S V Road, Thane, Maharashtra - 400694",32
ishaan96,*@2X6tW#a,Ishaan Tripathi,M,ishaan96@yahoo.com,7686660785,1995-04-07,"126, Park Street, Surat, Gujarat - 395025",23
bhaves5,GoV?2rmy,Bhavesh Banerjee,M,bhaves520@gmail.com,8108873621,1962-10-06,"223, Park Street, Dehradun, Uttarakhand - 248079",42
snehar24,*kXOc!m$mog95,Sneha Reddy,F,snehar2442@hotmail.com,7785392174,2002-03-28,"42, Shastri Nagar, Chandigarh, Chandigarh - 160032",2
smitap71,eTmG7m!!sdr,Smita Pillai,F,smitap71@gmail.com,6137701007,2001-11-12,"208, New Colony, Rajkot, Gujarat - 360085",33
radh77,q3K@q@52@V,Radhika Lal,F,radh7774@hotmail.com,6438985907,1973-01-09,"242, S V Road, Bilaspur, Chhattisgarh - 495076",6
meera85,o0G%OTCg,Meera Sinha,F,meera85@gmail.com,7189947117,1966-01-03,"29, Phase 1, Ahmedabad, Gujarat - 380041",12
rah13,QD@QY7TyNnKxc,Rahul Nambiar,M,rah133@mail.com,9613069121,1975-05-17,"217, Main Road, Aligarh, Uttar Pradesh - 202093",25
omk75,ypEF$94nj1,Omkar Shukla,M,omk75.@gmail.com,7099431240,1963-07-09,"185, Old Town, Coimbatore, Tamil Nadu - 641094",38
yash8,S5pVs5t7XdU#,Yash Saxena,M,yash840@gmail.com,8469341241,1980-07-12,"112, MG Road, Mangalore, Karnataka - 575015",50
aja09,$YFDgH!atzNc3r,Ajay Iyer,M,aja09@gmail.com,9739829941,1993-12-10,"30, Old Town, Indore, Madhya Pradesh - 452010",28
samee4,PM3Ti1!xo?7,Sameer Khan,M,samee4@yahoo.com,9002419600,1968-06-13,"115, S V Road, Kolkata, West Bengal - 700044",17
amits27,NWw?vUWWvWC9,Amit Shukla,M,amits27@mail.com,6156835243,1966-12-07,"56, Sector 14, Lucknow, Uttar Pradesh - 226020",31
nish4,OQN*h8twX,Nisha Saxena,F,nish4@outlook.com,6585100160,1981-04-13,"218, Rajiv Gandhi Road, Pune, Maharashtra - 411095",6
shanka8,JO%#8%Ra,Shankar Lal,M,shanka8@outlook.com,8572993950,1960-04-21,"139, MG Road, Surat, Gujarat - 395043",43
pranav05,Ys4u@IJ1,Pranav Joshi,M,pranav0575@outlook.com,6252190514,2002-05-09,"165, Civil Lines, Dehradun, Uttarakhand - 248012",45
ramesh1,zzDd56SPu@S,Ramesh Chandra,M,ramesh1@yahoo.com,8119378451,2003-01-31,"246, Shastri Nagar, Varanasi, Uttar Pradesh - 221072",26
ganesh9,Pg8b?P5e$fe,Ganesh Patel,M,ganesh9@yahoo.com,9783902503,1959-12-20,"93, Rajiv Gandhi Road, Bhopal, Madhya Pradesh - 462097",32
har30,Z!6W2GC4j,Harish Iyer,M,har30.@rediffmail.com,7002597869,1991-10-13,"140, Phase 1, Surat, Gujarat - 395065",16
kritin9,vxsh#jQTS1X,Kriti Nambiar,F,kritin9.@gmail.com,9608578234,1969-04-14,"132, S V Road, Pune, Maharashtra - 411023",4
jay56,V4eZr@%d?*,Jaya Sharma,F,jay56@gmail.com,8384450497,1977-10-20,"201, Market Road, Thiruvananthapuram, Kerala - 695080",9
shanka7,pUUPdB#xdWVlf6,Shankar Pillai,M,shanka7.@rediffmail.com,6311703959,1992-10-31,"2, Shastri Nagar, Kolkata, West Bengal - 700095",7
ritumi7,@9#8#gEs1Nyj,Ritu Mishra,F,ritumi7.@yahoo.com,9346785438,1973-02-22,"68, Market Road, Shillong, Meghalaya - 793011",43
ajaya7,Bzvx#Tk6nb,Ajay Agarwal,M,ajaya788@mail.com,6493266611,1975-03-12,"138, Phase 1, Dehradun, Uttarakhand - 248068",31
bha63,*cBQiR25p,Bhavna Sharma,F,bha63@mail.com,6573429831,1980-10-18,"235, New Colony, Surat, Gujarat - 395092",28
bhave06,O0V8Ub3w!,Bhavesh Kulkarni,M,bhave0680@rediffmail.com,9957875394,1969-12-02,"27, Ring Road, Mysore, Karnataka - 570086",17
lak95,oJMjF#Wpq2i,Lakshmi Patel,F,lak9592@rediffmail.com,7118028063,1996-12-07,"30, MG Road, Thane, Maharashtra - 400695",41
bha58,X1twL9em#,Bhavna Shah,F,bha5897@mail.com,7138587017,1959-07-08,"214, Shastri Nagar, Mangalore, Karnataka - 575041",24
neelam8,0s$wfA!D9A,Neelam Shukla,F,neelam858@hotmail.com,6389260635,1975-06-19,"108, Market Road, Vishakhapatnam, Andhra Pradesh - 530025",25
amrita5,T?rQ9N%z8GHN,Amrita Shah,F,amrita589@yahoo.com,7004794955,1974-10-04,"4, Ring Road, Thane, Maharashtra - 400695",1
